861,14.11.18,2018,Põhjarannik 27.10.18 Jõhvi võim lasi kogenud lasteaiajuhi päeva pealt lahti ,"Kaebaja ei ole rahul, et sõna ei saanud. Samuti peab kaebaja loo pealkirja eksitavaks. ",pressinõukogu otsus,pressinõukogu otsus,13.12.18,"ÕIGEKSMÕISTEV: Põhjarannik ei eksinud ajakirjanduseetika koodeksi vastu. Pressinõukogu hinnangul ei ole artikli pealkiri eksitav, sest see viitab loos avaldatud infole, et Jõhvi Lasteaiad direktor pidas vallandamisotsuse tegemisel nõu vallavalitsusega. Pressinõukogu hinnangul sai Jõhvi võim Jõhvi Lasteaiad direktori kaudu võimaluse ka oma seisukohta avaldada ja eraldi sõna vallavolikogu või vallavalitsuse esindajale anda ei olnud vaja. ",õigeksmõistev,õigeksmõistev,Põhjarannik,kirjutav meedia,[],0,0,0,0,0,0,0,0,0,0,0,0,0,0,0,0,0,0,0,0,0,0,0,0,0,0,0
860,13.11.18,2018,"Eesti Päevaleht 09.11.18 Kaitseväe salajased dokumendid rippusid aastaid avalikult internetis; Ajateenijad suitsetavad kanepit igavusest, harjumusest ja vastumeelsusest ","Kaebaja leiab, et artiklid sisldavad ebatäpset ja eksitavat infot, faktide tõesust ei ole kontrollitud ja kaebaja ei saanud sõna. ",pressinõukogu otsus,pressinõukogu otsus,13.12.18,"ÕIGEKSMÕISTEV: Leht ei eksinud ajakirjanduseetika koodeksi vastu. Pressinõukogu leiab, et kaitsevägi viitas oma vastuses selgelt rahatrahvi võimalusele, mida loo autorid tajusid katsena neid survestada. Artikli pealkiri „Kaitseväe salajased dokumendid rippusid aastaid avalikult internetis“ kasutab sõna „salajased“ mitte juriidilises, vaid tavatähenduses, et iseloomustada dokumente, mis ei ole avalikkusele kättesaadavad või antud juhul ei peaks olema kättesaadavad. Teise artikli puhul on kanepi suitsetamist käsitledes autorid tuginenud allikatele ja antud loo kontekstis on rahvuse käsitlemine kohane. ",õigeksmõistev,õigeksmõistev,Eesti Päevaleht,kirjutav meedia,[],0,0,0,0,0,0,0,0,0,0,0,0,0,0,0,0,0,0,0,0,0,0,0,0,0,0,0
859,30.10.18,2018,Pealinn 27.08.18 Aferistist arhitekt võltsib allkirju ja jätab majad pooleli ,"Kaebaja ei ole rahul, et teda on nimetatud võltsijaks (kurjategijaks), kuigi artikli ilmumise ajal oli kriminaalmenetlus veel käimas. Kaebaja ei ole rahul, et tema esitatud väiteid on artiklis moonutatud ja talle ei antud sõna kõikides asjaoludes. ",pressinõukogu otsus,pressinõukogu otsus,13.12.18,"ÕIGEKSMÕISTEV: Pealinn ei eksinud ajakirjanduseetika koodeksi vastu, sest kaebaja sai võimaluse esitatud süüdistusi kommenteerida. Pressinõukogu ei pea artikli pealkirja eksitavaks ega ebatäpseks, sest allkirjade võltsimist kinnitab toimetuse käsutuses olev info. ",õigeksmõistev,õigeksmõistev,Pealinn,kirjutav meedia,[],0,0,0,0,0,0,0,0,0,0,0,0,0,0,0,0,0,0,0,0,0,0,0,0,0,0,0
858,26.10.18,2018,Postimees 16.10.18 Saade ,"Kaebaja leiab, et saates avaldatakse tema kohta valeinfot. ",pressinõukogu otsus,pressinõukogu otsus,22.11.18,"ÕIGEKSMÕISTEV: Postimehe veeb ei eksinud ajakirjanduseetika koodeksi vastu. Kuna saatejuht esitas Helle-Moonika Helmele kutse saatesse kommunikatsioonijuhi vahendusel ja kaebaja saatesse ei tulnud, siis on Pressinõukogu hinnangul alus järeldada, et kaebaja ütles kutsest ära. ",õigeksmõistev,õigeksmõistev,Postimees,kirjutav meedia,[],0,0,0,0,0,0,0,0,0,0,0,0,0,0,0,0,0,0,0,0,0,0,0,0,0,0,0
857,23.10.18,2018,Eesti Päevaleht 14.09.18 Kümme päeva koolitust ja 280 eurot ning lapsest saab selgeltnägija? ,"Kaebaja ei ole rahul, et Jehoova tunnistajatele ei antud artiklis sõna ega avaldatud vastulauset. ",pressinõukogu otsus,pressinõukogu otsus,22.11.18,"ÕIGEKSMÕISTEV: Eesti Päevaleht ei eksinud ajakirjanduseetika koodeksi vastu. Pressinõukogu arvates oli Jehoova tunnistajate kohta avaldatu puhul tegemist psühholoogi hinnanguga, mis tugines endiste Jehoova tunnistajate veebilehele ja Jehoova tunnistajate veebilehel avaldatule. ",õigeksmõistev,õigeksmõistev,Eesti Päevaleht,kirjutav meedia,[],0,0,0,0,0,0,0,0,0,0,0,0,0,0,0,0,0,0,0,0,0,0,0,0,0,0,0
854,16.10.18,2018,"Postimees 02.10.18 Päeval ehitajad, õhtul roolijoodikud ja vargad ","Kaebaja leiab, et artikkel sisaldab valet ja põhjendamata hinnanguid. Kaebaja ei ole rahul, et ajakirjanik talle helistades end ei tutvustanud. Samuti ei ole kaebaja rahul, et ta sõna ei saanud. ",pressinõukogu otsus,pressinõukogu otsus,22.11.18,"ÕIGEKSMÕISTEV: Postimees ei eksinud ajakirjanduseetika koodeksi vastu. Pressinõukogu hinnangul ei ole Nomse OÜ kohta selliseid süüdistusi seoses võõrtööjõuga esitatud, et artikli ilmumise oleks ilma kaebaja kommentaarita pidanud edasi lükkama. Pressinõukogu kasutada olevast materjalist ei nähtu, et artiklis oleks esitatud valeandmeid. ",õigeksmõistev,õigeksmõistev,Postimees,kirjutav meedia,[],0,0,0,0,0,0,0,0,0,0,0,0,0,0,0,0,0,0,0,0,0,0,0,0,0,0,0
853,12.10.18,2018,Postimees 10.10.18 Korolev osutus samuti laimajaks ,"Kaebaja leiab, et artikkel sisaldab ebaõiget infot ja talle ei antud võimalust kõikidele süüdistustele sisuliselt vastata. ",pressinõukogu otsus,pressinõukogu otsus,22.11.18,"ÕIGEKSMÕISTEV: Postimees ei eksinud ajakirjanduseetika koodeksi vastu. Pressinõukogu hinnangul on teema tõstatamine avalikkuses põhjendatud, Pressinõukogul puuduvad tõendid, mis kinnitaksid kaebaja väiteid ning artiklis saavad kõik osapooled sõna. ",õigeksmõistev,õigeksmõistev,Postimees,kirjutav meedia,[],0,0,0,0,0,0,0,0,0,0,0,0,0,0,0,0,0,0,0,0,0,0,0,0,0,0,0
850,29.08.18,2018,Elu24 28.08.18 Kas kaunis raadiohääl Brigitte Susanne Hunt on meid kõiki lollitanud ja semmib ikka hoopis Nubluga? ,"Kaebaja leiab, et artikkel sisaldab faktivigu ja spekulatsioone. ",pressinõukogu otsus,pressinõukogu otsus,18.10.18,"ÕIGEKSMÕISTEV: Elu24 ei eksinud ajakirjanduseetika koodeksi vastu, sest kaebajale anti sõna. ",õigeksmõistev,õigeksmõistev,Elu24,kirjutav meedia,[],0,0,0,0,0,0,0,0,0,0,0,0,0,0,0,0,0,0,0,0,0,0,0,0,0,0,0
848,24.07.18,2018,Postimees 18.07.18 Avatud uks tõi ametnikule pahanduse kaela ,"Kaebaja leiab, et artiklis avaldatud faktid on kaheldavad. Samuti ei ole kaebaja rahul, et valla sotsiaaltööspetsialist sisuliselt sõna ei saanud. ",pressinõukogu otsus,pressinõukogu otsus,20.09.18,"ÕIGEKSMÕISTEV: Postimehe veebis ilmunud artikliga ei eksitud ajakirjanduseetika koodeksi vastu. Pressinõukogu hinnangul on mõlemad konflikti osapooled sõna saanud. Pressinõukogu hinnangul ei ole artikli teema mitte isik, kellest pealtkuuldud vestluses räägiti, vaid avatud uks ja sellega tekitatud võimalus kuulata pealt vestlusi, mis võivad sisaldada isikuandmeid. ",õigeksmõistev,õigeksmõistev,Postimees,kirjutav meedia,[],0,0,0,0,0,0,0,0,0,0,0,0,0,0,0,0,0,0,0,0,0,0,0,0,0,0,0
847,05.07.18,2018,Eesti Ekspress 25.04.18 Telesaade vaeste aitamisest tegi produtsent Kristi Nilovist jõuka inimese ,Kaebaja hinnangul sisaldab artikkel ebaõigeid faktiväiteid ja tõsiseid süüdistusi. ,pressinõukogu otsus,pressinõukogu otsus,18.10.18,"ÕIGEKSMÕISTEV: Leht ei rikkunud ajakirjanduseetika koodeksit. Pressinõukogu hinnangul ei ole vale kujundlikult väita, et Kristi Nilov on „Kodutunde“ suurim abisaaja. Pressinõukogu leiab, et endiste töötajate negatiivseid hinnanguid kaebaja kohta ei saa tõendada, sest need on isiklikud arvamused. Lisaks kahele negatiivsele arvamusele on portreeloos ka pikem positiivne hinnang Kristi Nilovi kohta. ",õigeksmõistev,õigeksmõistev,Eesti Ekspress,kirjutav meedia,[],0,0,0,0,0,0,0,0,0,0,0,0,0,0,0,0,0,0,0,0,0,0,0,0,0,0,0
845,25.06.18,2018,Delfi 06.06.18 Video. Tartu Ülikooli kliinikumi arst käratas patsiendile: minuga ei ole mõtet möiseda! Katkine varvas seo ise kinni tampooni abil ,"Kaebaja ei ole rahul, et video on filmitud ebaseaduslikult ja artikkel on eksitav. ",pressinõukogu otsus,pressinõukogu otsus,20.09.18,ÕIGEKSMÕISTEV: Delfi ei eksinud ajakirjanduseetika koodeksi vastu. Pressinõukogu hinnangul on artiklis saanud sõna osapooled – patsient ja haigla. Lisaks on kaebaja saanud sõna jätkuloos. Pressinõukogu hinnangul ei riku video avaldamine kaebaja eraelu puutumatust. ,õigeksmõistev,õigeksmõistev,Delfi,kirjutav meedia,[],0,0,0,0,0,0,0,0,0,0,0,0,0,0,0,0,0,0,0,0,0,0,0,0,0,0,0
844,21.06.18,2018,Lääne Elu 16.06.18 Lasteaia direktor läks vanemate kaebuse peale pensionile ,"Kaebaja leiab, et artikkel sisaldab valeinfot ja tekitab põhjendamata kannatusi. ",pressinõukogu otsus,pressinõukogu otsus,20.09.18,"ÕIGEKSMÕISTEV: Lääne Elu ei eksinud ajakirjanduseetika koodeksi vastu. Pressinõukogu hinnangul oli artikkel konfliktist lasteaias ja linna haridusnõuniku võimalikust võimu kuritarvitamisest, mitte niivõrd konkreetsest lapsest. Pressinõukogu arvates on laps tuvastatav vaid piiratud ringis, kes lasteaias toimuvat juba niigi teavad. Pressinõukogu leiab, et artikli põhjal ei ole võimalik last laiemas ringis tuvastada. Samuti leiab Pressinõukogu, et kaebajale pakuti sõna, kuid kaebaja sisulist kommentaari ei andnud. ",õigeksmõistev,õigeksmõistev,Lääne Elu,kirjutav meedia,[],0,0,0,0,0,0,0,0,0,0,0,0,0,0,0,0,0,0,0,0,0,0,0,0,0,0,0
842,20.06.18,2018,Tartu Postimees 06.06.18 Video. Valvearst öisele abipaljujale: ,"Kaebaja leiab, et artikkel sisladab eksitavaid fakte ja on halvustav. ",pressinõukogu otsus,pressinõukogu otsus,20.09.18,ÕIGEKSMÕISTEV: Tartu Postimees ei eksinud ajakirjanduseetika koodeksi vastu. Pressinõukogu hinnangul on artiklites saanud sõna osapooled – patsient ja haigla. Lisaks on kaebaja saanud sõna paberlehes avaldatud loos. Pressinõukogu hinnangul ei riku video avaldamine kaebaja eraelu puutumatust. ,õigeksmõistev,õigeksmõistev,Postimees,kirjutav meedia,[],0,0,0,0,0,0,0,0,0,0,0,0,0,0,0,0,0,0,0,0,0,0,0,0,0,0,0
841,11.06.18,2018,Lääne Elu 17.04.18 Postimees: purjus kapten ajas Morobelli laeva madalikule ,Kaebaja hinnangul sisaldab artikkel valeinfot. ,pressinõukogu otsus,pressinõukogu otsus,20.09.18,"ÕIGEKSMÕISTEV: Lääne Elu ei eksinud ajakirjanduseetika koodeksi vastu. Pressinõukogu hinnangul kommenteeris juhtunut Morobelli esindaja, mis näitab, et kalalaev on sisuliselt Morobelli kontrolli all. ",õigeksmõistev,õigeksmõistev,Lääne Elu,kirjutav meedia,[],0,0,0,0,0,0,0,0,0,0,0,0,0,0,0,0,0,0,0,0,0,0,0,0,0,0,0
838,31.05.18,2018,Delfi 30.05.18 Stolitsa peatoimetaja Aleksandr Tšaplõgin ja tema sõbrad rõõmustasid sotsiaalmeedias Babtšenko surma üle ,"Kaebaja leiab, et artikkel sisaldab valeinfot. ",pressinõukogu otsus,pressinõukogu otsus,30.08.18,"ÕIGEKSMÕISTEV: Delfi ei eksinud ajakirjanduseetika koodeksi vastu. Pressinõukogu leiab, et loo pealkiri vastab sisule, sest kaebaja sotsiaalmeedia postituses tuntakse kahjurõõmu või parastatakse Arkadi Babtšenko surma üle. ",õigeksmõistev,õigeksmõistev,Delfi,kirjutav meedia,[],0,0,0,0,0,0,0,0,0,0,0,0,0,0,0,0,0,0,0,0,0,0,0,0,0,0,0
837,31.05.18,2018,Eesti Päevaleht 11.04.18 Analüüs: apteegireformi propagandasõjast väljub võitjana ainult Margus Linnamäe ,"Kaebaja peab artikli pealkirja ja sisu eksitavaks. Kaebaja leiab, et loos ei ole faktid ja oletused eristatud. Kaebaja ei ole rahul, et ei saanud võimalust oma seisukoha avaldamiseks. ",pressinõukogu otsus,pressinõukogu otsus,30.08.18,"ÕIGEKSMÕISTEV: Eesti Päevaleht ei eksinud ajakirjanduseetika koodeksi vastu. Pressinõukogu leiab, et kuna tegemist on arvamuslooga, apteegireformi analüüsiga ja Eesti Apteekrite Liidu kohta ei ole konkreetselt süüdistusi esitatud, ei olnud põhjust kaebajale sõna anda. ",õigeksmõistev,õigeksmõistev,Eesti Päevaleht,kirjutav meedia,[],0,0,0,0,0,0,0,0,0,0,0,0,0,0,0,0,0,0,0,0,0,0,0,0,0,0,0
836,31.05.18,2018,"Pärnu Postimees 28.03.18 Pere sai kodu kõrvale rajatud laskepaigast teada siis, kui kuulid juba lendasid ","Kaebaja leiab, et artikkel sisaldab ebaõiget infot ja foto on naeruvääristav. ",pressinõukogu otsus,pressinõukogu otsus,20.09.18,"ÕIGEKSMÕISTEV: Pärnu Postimees ei rikkunud ajakirjanduseetika koodeksit. Pressinõukogu hinnangul pärineb sihtmärgi foto „Pealtnägija“ saatest ja Pressinõukogu nõustub toimetuse selgitusega, et foto põhjal ei ole võimalik väita, et tulistada saab hõlpsasti üle valli. ",õigeksmõistev,õigeksmõistev,Pärnu Postimees,kirjutav meedia,[],0,0,0,0,0,0,0,0,0,0,0,0,0,0,0,0,0,0,0,0,0,0,0,0,0,0,0
835,31.05.18,2018,"Õhtuleht 28.03.18 „“Pealtnägija“: kodutalust 500 meetri kaugusele tekkis erafirma laskepaik, millest naabruskonna elanikke ei teavitatudki ","Kaebaja leiab, et artikkel sisaldab ebaõiget infot. ",pressinõukogu otsus,pressinõukogu otsus,20.09.18,"ÕIGEKSMÕISTEV: Õhtuleht ei rikkunud ajakirjanduseetika koodeksit. Pressinõukogu leiab, et S-Arms sai refereeritud loos sõna ja toimetusel polnud alust kahelda allika väites, et laskepaiga ümber enne valli ei olnud. Ka maja poole laskmist ja täiendava valli ehitamist kinnitab loos allikas. ",õigeksmõistev,õigeksmõistev,Õhtuleht,kirjutav meedia,[],0,0,0,0,0,0,0,0,0,0,0,0,0,0,0,0,0,0,0,0,0,0,0,0,0,0,0
834,31.05.18,2018,Eesti Rahvusringhääling 28.03.18 Pealtnägija ,"Kaebaja leiab, et saade on negatiivne ja sisaldab ebaõiget infot. Samuti ei ole kaebaja rahul, et kaebaja vastus ei ole tervenisti leitav. ",pressinõukogu otsus,pressinõukogu otsus,20.09.18,"ÕIGEKSMÕISTEV: ERR ei rikkunud ajakirjanduseetika koodeksit. Pressinõukogu leiab, et S-Arms sai loos piisavalt sõna ja kui kaebaja otsustas intervjuust keelduda, on see kaebaja valik. Pressinõukogu leiab, et kaitsevalli kohta avaldavad oma arvamust kohalikud elanikud ja valli kõrguse kohta ei esitata saates fakte, vaid hinnanguid. ",õigeksmõistev,õigeksmõistev,ERR,rääkiv meedia,[],0,0,0,0,0,0,0,0,0,0,0,0,0,0,0,0,0,0,0,0,0,0,0,0,0,0,0
831,15.05.18,2018,Postimehe veeb 14.05.18 Marek-Lars Kruusen: fundamentaalfüüsika teaduse suund Eesti ülikoolides on hakanud arenema väärastunud teed pidi ,Kaebajate hinnangul sisaldab artikkel valeväiteid. ,pressinõukogu otsus,pressinõukogu otsus,30.08.18,"ÕIGEKSMÕISTEV: Pressinõukogu hinnangul oli tegemist arvamuslooga, kus autor väljendas oma seisukohti. Lugu oli nähtav vaid tund aega, kuni Postimees ise tuvastas artikli mittevastavuse oma kvaliteedinõuetele ja võttis loo maha. ",õigeksmõistev,õigeksmõistev,Postimees,kirjutav meedia,[],0,0,0,0,0,0,0,0,0,0,0,0,0,0,0,0,0,0,0,0,0,0,0,0,0,0,0
828,09.05.18,2018,"Eesti Ekspress 11.04.18 Adjöö, stiili- ja ilunipid! ","Kaebaja leiab, et uudis sisaldab valeinfot ja on ühepoolne. ",pressinõukogu otsus,pressinõukogu otsus,30.08.18,"ÕIGEKSMÕISTEV: Ekspress ei eksinud ajakirjanduseetika koodeksi vastu. Pressinõukogu leiab, et toimetuse käsutuses olnud info oli usaldusväärne. ",õigeksmõistev,õigeksmõistev,Eesti Ekspress,kirjutav meedia,[],0,0,0,0,0,0,0,0,0,0,0,0,0,0,0,0,0,0,0,0,0,0,0,0,0,0,0
826,25.04.18,2018,Kanal 2 03.04.18 Radar ,"Kaebaja leiab, et saade põhjustab tema lähedastele moraalset kahju. Samuti leiab kaebaja, et saade sisaldab faktivigu ning on eksitav ja ühepoolne. ",pressinõukogu otsus,pressinõukogu otsus,20.06.18,"ÕIGEKSMÕISTEV: Kanal 2 ei rikkunud 3. aprilli saates „Radar“ ajakirjanduseetika koodeksit. Pressinõukogu hinnangul on saates tuginetud dokumentidele ja vallaametnike ütlustele, samuti on saates pakutud sõna kaebajale ja avaldatud tema seisukohad, mille toimetus sai kaebajalt telefoni või meili teel. ",õigeksmõistev,õigeksmõistev,Kanal2,rääkiv meedia,[],0,0,0,0,0,0,0,0,0,0,0,0,0,0,0,0,0,0,0,0,0,0,0,0,0,0,0
825,23.04.18,2018,Õhtuleht 15.03.18 Kremlimeelne kanal tegi Eesti ajateenija tulistamisest propagandaloo ,"Kaebaja leiab, et artikkel sisldab valet ja eksitavat infot. Samuti ei ole kaebaja rahul, et neile sõna ei antud. ",pressinõukogu otsus,pressinõukogu otsus,20.06.18,"ÕIGEKSMÕISTEV: Õhtuleht ei rikkunud ajakirjanduseetika koodeksit. Kuna Sputnik avaldas 2. märtsil ajateenija tulistamise kohta loo, siis on nad teema ja kampaania ise algatanud. Pressinõukogu hinnangul kajastuvad Sputniku seisukohad nende küsimustes, mis uudises avaldati. ",õigeksmõistev,õigeksmõistev,Õhtuleht,kirjutav meedia,[],0,0,0,0,0,0,0,0,0,0,0,0,0,0,0,0,0,0,0,0,0,0,0,0,0,0,0
824,23.04.18,2018,"Venekeelne Postimees 15.03.18 Venelast tulistati põgenemiskatsel: Sputnik muutis lugu eestlasest, kes oli ennast ägeda armi saamiseks haavanud ","Kaebaja hinnangul sisldab artikkel valet. Kaebaja ei ole rahul, et sõna ei saanud. ",pressinõukogu otsus,pressinõukogu otsus,20.06.18,"ÕIGEKSMÕISTEV: Rus.Postimees ei rikkunud ajakirjanduseetika koodeksit. Kuna Sputnik avaldas 2. märtsil ajateenija tulistamise kohta loo, siis on nad teema ja kampaania ise algatanud. Pressinõukogu hinnangul kajastuvad Sputniku seisukohad nende küsimustes, mis uudises avaldati. ",õigeksmõistev,õigeksmõistev,Postimees,kirjutav meedia,[],0,0,0,0,0,0,0,0,0,0,0,0,0,0,0,0,0,0,0,0,0,0,0,0,0,0,0
823,23.04.18,2018,Postimees 15.03.18 Sputnik esitab Eesti ajateenija juhtumi valguses valeväiteid ,"Kaebaja leiab, et artikkel sisaldab valeväiteid. Samuti ei ole kaebaja rahul, et neile sõna ei antud. ",pressinõukogu otsus,pressinõukogu otsus,20.06.18,"ÕIGEKSMÕISTEV: Postimees ei rikkunud ajakirjanduseetika koodeksit. Kuna Sputnik avaldas 2. märtsil ajateenija tulistamise kohta loo, siis on nad teema ja kampaania ise algatanud. Pressinõukogu hinnangul kajastuvad Sputniku seisukohad nende küsimustes, mis uudises avaldati. ",õigeksmõistev,õigeksmõistev,Postimees,kirjutav meedia,[],0,0,0,0,0,0,0,0,0,0,0,0,0,0,0,0,0,0,0,0,0,0,0,0,0,0,0
822,23.04.18,2018,Eesti Rahvusringhääling 15.03.18 Sputnik rakendas Eesti ajateenija tulistamisjuhtumi propagandavankri ette ,"Kaebaja leiab, et artikkel sisaldab valet. Samuti ei ole kaebaja rahul, et neile sõna ei antud. ",pressinõukogu otsus,pressinõukogu otsus,20.06.18,"ÕIGEKSMÕISTEV: ERR ei rikkunud ajakirjanduseetika koodeksit. Kuna Sputnik avaldas 2. märtsil ajateenija tulistamise kohta loo, siis on nad teema ja kampaania ise algatanud. Pressinõukogu hinnangul kajastuvad Sputniku seisukohad nende küsimustes, mis uudises avaldati. ",õigeksmõistev,õigeksmõistev,ERR,rääkiv meedia,[],0,0,0,0,0,0,0,0,0,0,0,0,0,0,0,0,0,0,0,0,0,0,0,0,0,0,0
821,20.04.18,2018,Postimees 12.04.18 Konkurentsiamet pööras elektritarbijatele selja ,"Kaebaja ei ole rahul, et talle sõna ei antud. ",pressinõukogu otsus,pressinõukogu otsus,20.06.18,"ÕIGEKSMÕISTEV: Postimees ei eksinud ajakirjanduseetika koodeksi vastu. Pressinõukogu hinnangul ei olnud Eesti Energia konflikti osapool, kellele oleks pidanud tingimata sõna andma. Pressinõukogu leiab, et artikkel sisaldab konkurentsiameti kaudu ka Eesti Energia seisukohti kajastavat infot. ",õigeksmõistev,õigeksmõistev,Postimees,kirjutav meedia,[],0,0,0,0,0,0,0,0,0,0,0,0,0,0,0,0,0,0,0,0,0,0,0,0,0,0,0
818,08.04.18,2018,TV3 02.04.18 Kuuuurija ,"Kaebaja leiab, et saade sisaldab tema kohtu moonutatud infot ja valet. Samuti leiab kaebaja, et saates on avaldatud infot, mida avalikkusel ei olnud vaja teada. ",pressinõukogu otsus,pressinõukogu otsus,24.05.18,"ÕIGEKSMÕISTEV: „Kuuuurija“ ei rikkunud ajakirjanduseetika koodeksit. Pressinõukogu hinnangul on konflikti mõlemad osapooled saanud piisavas mahus sõna. Pressinõukogu leiab, et kaebaja tausta avamine oli oluline, sest Abakhani töötajad kahtlustasid teda varguses. Samuti ei loodud kaebajast eksitavat kuvandit. ",õigeksmõistev,õigeksmõistev,TV3,rääkiv meedia,[],0,0,0,0,0,0,0,0,0,0,0,0,0,0,0,0,0,0,0,0,0,0,0,0,0,0,0
817,04.04.18,2018,"Eesti Päevaleht 15.02.18 Juhtkirjad „Nii maksumaksja kui ka karskuse vaenlane“ (15.02.2018) ja „Ossinovski, teie olete probleem“ (27.02.2018) ning artikkel „Ossinovski juhib tähelepanu endalt alkoholile“ (1.03.2018) ",Kaebaja peab artikleid eksitavaks ja ühepoolseteks. ,pressinõukogu otsus,pressinõukogu otsus,20.06.18,"ÕIGEKSMÕISTEV: Pressinõukogu leidis, et juhtkirjades ei ole leht eksinud ajakirjanduseetika koodeksi vastu, sest juhtkirjas on toimetusel õigus oma arvamust avaldada ja hinnanguid anda. Sama kehtib ka arvamusartikli puhul. Lisaks on arvamusloo all viidatud ka sellele, kus saab lugeda Jevgeni Ossinovski kirja täisteksti. ",õigeksmõistev,õigeksmõistev,Eesti Päevaleht,kirjutav meedia,[],0,0,0,0,0,0,0,0,0,0,0,0,0,0,0,0,0,0,0,0,0,0,0,0,0,0,0
816,28.03.18,2018,Virumaa Teataja 17.03.18 Nädala kaja: susserdamine ei kao kuhugi ,"Kaebaja leiab, et artikkel sisaldab tema kohta valeväiteid. Samuti ei ole kaebaja rahul, et talle sõna ei antud. ",pressinõukogu otsus,pressinõukogu otsus,24.05.18,"ÕIGEKSMÕISTEV: Virumaa Teataja ei eksinud ajakirjanduseetika koodeksi vastu. Kuna tegemist on arvamuslooga, siis on ajakirjanikul õigus selles oma hinnanguid anda. ",õigeksmõistev,õigeksmõistev,Virumaa Teataja,kirjutav meedia,[],0,0,0,0,0,0,0,0,0,0,0,0,0,0,0,0,0,0,0,0,0,0,0,0,0,0,0
815,24.03.18,2018,TV3 29.01.18 Kuuuurija ,"Kaebaja leiab, et saade sisaldab valeväiteid ja spekulatsioone, mida faktid ei toeta. ",pressinõukogu otsus,pressinõukogu otsus,24.05.18,"ÕIGEKSMÕISTEV: Pressinõukogu hinnangul on ""Kuuuurija"" pakkunud piisavalt sõna Teater NO99 esindajatele, et nad saaksid sisuliselt vastata kõikidele küsimustele. Teater seda võimalust ei kasutanud ja eelistas anda formaalseid vastuseid. ",õigeksmõistev,õigeksmõistev,TV3,rääkiv meedia,[],0,0,0,0,0,0,0,0,0,0,0,0,0,0,0,0,0,0,0,0,0,0,0,0,0,0,0
813,12.03.18,2018,Õhtuleht 27.02.18 ,"Kaebaja leiab, et artikkel sisaldab valet ja moonutatud infot. ",pressinõukogu otsus,pressinõukogu otsus,24.05.18,"ÕIGEKSMÕISTEV: Õhtuleht ei eksinud ajakirjanduseetika koodeksi vastu. Pressinõukogu leiab, et artikkel sisaldab piisavas mahus OÜ Õuetuba ja selle juhataja Kristi Nilovi seisukohti. Pressinõukogu hinnangul ei ole ka kaebaja ümber lükanud artiklis avaldatud väiteid, et maja ostis firma ja et ta elab seal oma perega. ",õigeksmõistev,õigeksmõistev,Õhtuleht,kirjutav meedia,[],0,0,0,0,0,0,0,0,0,0,0,0,0,0,0,0,0,0,0,0,0,0,0,0,0,0,0
810,06.03.18,2018,Eesti Ekspress 31.01.18 Inetu tüli iluäris: röövimine päise päeva ajal telekaamerate ja politsei silme all ,"Kaebaja leiab, et artikkel sisaldab faktivigu ja loo pealkiri on eksitav. Samuti ei ole kaebaja rahul, et talle sõna ei antud. ",pressinõukogu otsus,pressinõukogu otsus,24.05.18,"ÕIGEKSMÕISTEV: Leht ei eksinud ajakirjanduseetika koodeksi vastu. Pressinõukogu hinnangul on konflikti osapoolte tegevust kajastatud ja mõlemad pooled on saanud sõna. Pressinõukogu hinnangul ei ole artikli pealkiri kaebaja suhtes eksitav ega solvav, sest on kooskõlas toimunuga ja artikli sisuga. ",õigeksmõistev,õigeksmõistev,Eesti Ekspress,kirjutav meedia,[],0,0,0,0,0,0,0,0,0,0,0,0,0,0,0,0,0,0,0,0,0,0,0,0,0,0,0
809,06.03.18,2018,TV3 05.03.18 Kuuuurija ,"Kaebaja väitel avaldati saates tema kohta valeinfot. Kaebaja ei ole rahul, et ajakirjanik tema väiteid ei uurinud ja sisenes luba küsimata tema tööruumidesse filmima. ",pressinõukogu otsus,pressinõukogu otsus,24.05.18,"ÕIGEKSMÕISTEV: TV3 ei rikkunud ajakirjanduseetika koodeksit. Pressinõukogu hinnangul sai kaebaja sõna. Pressinõukogu leiab, et kaebaja kirjast loeti ette olulisemad faktid, ülejäänud tekst oli samal ajal ekraanil näha. ",õigeksmõistev,õigeksmõistev,TV3,rääkiv meedia,[],0,0,0,0,0,0,0,0,0,0,0,0,0,0,0,0,0,0,0,0,0,0,0,0,0,0,0
808,06.03.18,2018,TV3 05.03.18 Kuuuurija ,"Kaebaja leiab, et saates avaldati tema kohta valeinfot. Kaebaja peab saates avalikustatud salvestist ebaseaduslikuks, sest ta ei teadnud, et tema vestlust salvestati. ",pressinõukogu otsus,pressinõukogu otsus,26.04.18,"ÕIGEKSMÕISTEV: Saates ei eksitud ajakirjanduseetika koodeksi vastu, sest kaebajat puudutav konflikt ei olnud saate põhiteema, lisaks ei ole kaebaja tuvastatav. ",õigeksmõistev,õigeksmõistev,TV3,rääkiv meedia,[],0,0,0,0,0,0,0,0,0,0,0,0,0,0,0,0,0,0,0,0,0,0,0,0,0,0,0
807,26.02.18,2018,Eesti Rahvusringhääling 24.02.18 Aktuaalne kaamera ,Kaebajate hinnangul oli AK saatelõik eksitav. ,pressinõukogu otsus,pressinõukogu otsus,26.04.18,"ÕIGEKSMÕISTEV: ERR ei rikkunud ajakirjanduseetika koodeksit. Pressinõukogu hinnangul oli tegemist aktsiooni lühikirjeldusega, milles rõhutati, et tegemist oli aktsiisipoliitika vastase üritusega. Samuti ei pea Pressinõukogu eksitavaks tuhatkonna auto nimetamist. ",õigeksmõistev,õigeksmõistev,ERR,rääkiv meedia,[],0,0,0,0,0,0,0,0,0,0,0,0,0,0,0,0,0,0,0,0,0,0,0,0,0,0,0
806,23.02.18,2018,Eesti Eksperss 03.01.18 McDonaldsi maja bossil kukkusid hambad suust: ,"Kaebaja ei ole rahul, et teda on artiklis nimetatud vanaks juudiks. ",pressinõukogu otsus,pressinõukogu otsus,26.04.18,"ÕIGEKSMÕISTEV: Ekspress ei eksinud ajakirjanduseetika koodeksi vastu. Pressinõukogu hinnangul on tegemist pigem hea maitse küsimusega, kas sellist väljendit kasutada või mitte. ",õigeksmõistev,õigeksmõistev,muu väljaanne,muu meedia,[],0,0,0,0,0,0,0,0,0,0,0,0,0,0,0,0,0,0,0,0,0,0,0,0,0,0,0
805,19.02.18,2018,Venekeelne Delfi 05.02.18 Meie tervist ei hinnata! Lasnamäe gümnaasiumi õpilased sõdivad koolisöökla toidu vastu ,"Kaebaja leiab, et artikkel sisaldab valeinfot ja kahtlase päritluga fotosid. Kaebaja ei ole rahul, et tema kommentaar avaldati luba küsimata. ",pressinõukogu otsus,pressinõukogu otsus,26.04.18,ÕIGEKSMÕISTEV: Delfi ei rikkunud ajakirjanduseetika koodeksit. Pressinõukogu hinnangul on artiklis avaldatud info kontrollitud ning sõna on saanud nii õpilased kui ka direktor. ,õigeksmõistev,õigeksmõistev,Delfi,kirjutav meedia,[],0,0,0,0,0,0,0,0,0,0,0,0,0,0,0,0,0,0,0,0,0,0,0,0,0,0,0
