647,11.04.16,2016,"Eesti Päevaleht 06.04.16 Linnamuuseumi juhi fotoost tekitab töötajates kahtlusi, Eesti Päevalehe artikkel vallandas nõiajahi ","Kaebaja hinnangul sisaldavad artiklid ebatäpset infot ja muusumi esindajale ei ole antud sõna. Samuti ei ole kaebaja rahul, et esimeses artiklis on rõhutatud muusumi juhi religioosset kuuluvust. ",pressinõukogu otsus,pressinõukogu otsus,26.05.16,"ÕIGEKSMÕISTEV: Päevaleht ei ole eksinud ajakirjanduseetika koodeksi vastu. Pressinõukogu hinnangul vastutab asutuse direktor kogu muuseumi töö eest ja peab olema valmis tegevust kommenteerima. Samuti on antud loo kontekstis muuseumi direktori usulise kuuluvuse rõhutamine. Pressinõukogu ei hakka võtma seisukohta selles, kas muuseum on fotokogu soetades lähtunud muuseumi kogumispoliitikast. ",õigeksmõistev,õigeksmõistev,Eesti Päevaleht,kirjutav meedia,[],0,0,0,0,0,0,0,0,0,0,0,0,0,0,0,0,0,0,0,0,0,0,0,0,0,0,0
646,08.04.16,2016,Eesti Päevaleht 08.04.16 Tallinna ja mere abielu on endiselt karidel ,"Kaebaja leiab, et artiklis on firma kohta esitatud kriitikat, kuid sõna antud ei ole. Samuti sialdab lugu ebaõiget faktiväidet. ",pressinõukogu otsus,pressinõukogu otsus,26.05.16,"ÕIGEKSMÕISTEV: Päevaleht ei ole rikkunud ajakirjanduseetika koodeksit. Tegemist ei ole uudisloo, vaid reportaaþiga, mille fookus ei ole Kalaranna sadama sulgemisel. Pressinõukogu hinnangul ei ole Pro Kapital seetõttu kogu artikli kontekstis selliseks osapooleks, kes pidanuks saama võimaluse kommentaariks. Lisaks kajastavad foto ja selle allkiri tegelikku olukorda – ala on aiaga piiratud ja silt „Merd kõigile“ on selle juures. ",õigeksmõistev,õigeksmõistev,Eesti Päevaleht,kirjutav meedia,[],0,0,0,0,0,0,0,0,0,0,0,0,0,0,0,0,0,0,0,0,0,0,0,0,0,0,0
642,01.04.16,2016,Virumaa Teataja 19.03.16 Õpilase säuts tõi kaasa konflikti õpetajatega ,"Kaebaja leiab, et artikkel sisidab valefakte ja toimetus ei ole kontrollinud allikate usaldusväärsust. Samuti leiab kaebaja, et osa infot ei ole hangitud avalikult ja lapsi ei ole intervjueeritud täiskasvanu juuresolekul. ",pressinõukogu otsus,pressinõukogu otsus,26.05.16,"ÕIGEKSMÕISTEV: Virumaa Teataja ei eksinud ajakirjanduseetika koodeksi vastu. Pressinõukogu arvates on sõna saanud kõik osapooled. Kuna toimetus kinnitas, et alaealiste sisukohti ei kasutatud, siis ei näe Pressinõukogu ka siin ajakirjanduseetika koodeksi rikkumist. ",õigeksmõistev,õigeksmõistev,Virumaa Teataja,kirjutav meedia,[],0,0,0,0,0,0,0,0,0,0,0,0,0,0,0,0,0,0,0,0,0,0,0,0,0,0,0
641,30.03.16,2016,"Eesti Ekspress 16.03.16 Kuidas pritsimajast sai ""litsimaja"" ",Kaebaja hinnangul on artikli pealkiri eksitav ning lugu sisaldab ebatäpset ja eksitavat infot. ,pressinõukogu otsus,pressinõukogu otsus,26.05.16,"ÕIGEKSMÕISTEV: Ekspress ei ole eksinud ajakirjanduseetika koodeksi vastu. Pressinõukogu hinnangul ei ole artikli fookus mitte litsimajal või prostitutsioonil, vaid tuletõrjeühingu jaoks kahjulikel kinnisvaratehingutel. Ka ei ole kaebaja väitnud, et artikli fookus oleks vale või mingil muul moel ekslik. ",õigeksmõistev,õigeksmõistev,Eesti Ekspress,kirjutav meedia,[],0,0,0,0,0,0,0,0,0,0,0,0,0,0,0,0,0,0,0,0,0,0,0,0,0,0,0
637,26.02.16,2016,Pärnu Postimees 26.11.15 Vanglast vabanenud tapja ähvardas ja peksis naist mitu kuud ,"Kaebaja ei ole rahul, et talle artiklis sõna ei antud ja et teda on käsitletud kurjategijana enne vastavat kohtuotsust. ",pressinõukogu otsus,pressinõukogu otsus,21.04.16,"ÕIGEKSMÕISTEV: Pärnu Postimees ei ole eksinud ajakirjanduseetika koodeksi vastu. Pressinõukogu hinnangul on väljaannetel õigus kirjutada kohtuotsustest ja kuna antud juhul oli tegemist kokkuleppemenetlusega ja kaebaja tunnistas end süüdi, siis ei ole eetikakoodeksit rikutud. ",õigeksmõistev,õigeksmõistev,Pärnu Postimees,kirjutav meedia,[],0,0,0,0,0,0,0,0,0,0,0,0,0,0,0,0,0,0,0,0,0,0,0,0,0,0,0
636,25.02.16,2016,Harju Elu 18.12.15 Endine Playboy väljaandja plaanib maa-alust elektrijaama ,"Kaebaja leiab, et artikkel sisaldab eksitavat ja halvustavat infot ning ta ei saanud võimalust kõiki vastaspoole väiteid kommenteerida. ",pressinõukogu otsus,pressinõukogu otsus,21.04.16,"ÕIGEKSMÕISTEV: Leht ei eksinud ajakirjanduseetika koodeksi vastu, sest Andre Lindvest on saanud artiklis sõna. Pressinõukogu hinnangul on lehel õigus seostada kaebaja varasemat tegevust tema käimasoleva projektiga. Pressinõukogu leiab, et sellisel juhul ei ole tegemist halvustamisega. Pressinõukogu ei pea eksitavaks artikli pealkirja, vahepealkirju ega ka fotoallkirju, sest need tuginevad faktidele ja on seotud artikli sisuga. ",õigeksmõistev,õigeksmõistev,Harju Elu,kirjutav meedia,[],0,0,0,0,0,0,0,0,0,0,0,0,0,0,0,0,0,0,0,0,0,0,0,0,0,0,0
634,18.02.16,2016,"Delfi 14.02.16 Kas Savisaar võttis altkäemaksu vastu, aga vastuteenet ei kavatsenudki osutada? ","Kaebaja leiab, et artikkel käsitleb teda kui kurjategijat, kuigi teda ei ole süüdi mõistetud. ",pressinõukogu otsus,pressinõukogu otsus,31.03.16,"ÕIGEKSMÕISTEV: Delfi ei ole rikkunud ajakirjanduseetika koodeksit, sest tegemist on arvamuslooga, mis on analüütiline ja sisaldab hüpoteese. ",õigeksmõistev,õigeksmõistev,Delfi,kirjutav meedia,[],0,0,0,0,0,0,0,0,0,0,0,0,0,0,0,0,0,0,0,0,0,0,0,0,0,0,0
630,05.02.16,2016,Äripäev 29.01.16 Eesti Energia solgib turgu ,"Kaebaja hinnangul on juhtkirjas esitatud tõele mitte vastavat, eksitavat ja moonutatud infot. ",pressinõukogu otsus,pressinõukogu otsus,31.03.16,"ÕIGEKSMÕISTEV: Äripäev ei ole eksinud ajakirjanduseetika koodeksi vastu. Pressinõukogu leiab, et Eesti Energia oleks võinud võtta vastu Äripäeva pakkumise oma seisukohtade avaldamiseks. ",õigeksmõistev,õigeksmõistev,Äripäev,kirjutav meedia,[],0,0,0,0,0,0,0,0,0,0,0,0,0,0,0,0,0,0,0,0,0,0,0,0,0,0,0
628,01.02.16,2016,Äripäev 04.12.15 Tallinn Dollsi hämarad ärikombed ,"Kaebajad ei ole rahul, et nende valdavalt positiivsed kommentaarid on pandud negatiivsesse valgusesse. Mari Martin leiab, et artikkel sisaldab faktivigu. ",pressinõukogu otsus,pressinõukogu otsus,31.03.16,ÕIGEKSMÕISTEV: Äripäev ei ole eksinud ajakirjanduseetika koodeksi vastu. Pressinõukogu ei kahtle esitatud materjalide põhjal allikate usaldusväärsuses. Samuti kinnitab ka kaebaja arvete tasumisega hilinemist. Ülejäänud kaebaja poolt viidatud faktivead ei leidnud kinnitust. ,õigeksmõistev,õigeksmõistev,Äripäev,kirjutav meedia,[],0,0,0,0,0,0,0,0,0,0,0,0,0,0,0,0,0,0,0,0,0,0,0,0,0,0,0
625,21.01.16,2016,"Eesti Päevaleht 08.01.16 Revisjonikomisjoni liige otsib Põhja-Tallinna ""kadunud arveid"" ","Kaebaja hinnangul on artiklis ja selle pealkirjas ebatäpne, eksitav ja moonutatud info. ",pressinõukogu otsus,pressinõukogu otsus,18.02.16,"ÕIGEKSMÕISTEV: Päevaleht ei ole eksinud ajakirjanduseetika koodeksi vastu. Pressinõukogu leiab, et kaebaja oleks pidanud Eesti Päevalehele antud vastustes välja tooma, et osasid dokumente ei ole, sest nende koostamise kohustus puudus. Pressinõukogu ei pea artikli pealkirja eksitavaks. ",õigeksmõistev,õigeksmõistev,Eesti Päevaleht,kirjutav meedia,[],0,0,0,0,0,0,0,0,0,0,0,0,0,0,0,0,0,0,0,0,0,0,0,0,0,0,0
624,20.01.16,2016,"Delfi, Eesti Päevaleht 13.01.16 ""Kremli-meelne ja häälekas ""lastekaitse"" rühib Eesti poliitikasse"" ja seotud artiklid ","Kaebaja hinnangul sisaldavad artiklid tõsiseid süüdistusi ja faktideta väiteid. Kaebaja ei ole rahul, et toimetus ei avaldanud vastulauset. ",pressinõukogu otsus,pressinõukogu otsus,18.02.16,ÕIGEKSMÕISTEV: Delfi ja Eesti Päevaleht ei ole eksinud ajakirjanduseetika koodeksi vastu. Pressinõukogu hinnangul on kaebajale sõna antud ja MTÜ on saanud võimaluse Kremli-meelsuse süüdistused ümber lükata. ,õigeksmõistev,õigeksmõistev,Delfi,kirjutav meedia,[],0,0,0,0,0,0,0,0,0,0,0,0,0,0,0,0,0,0,0,0,0,0,0,0,0,0,0
622,14.01.16,2016,"Eesti Päevaleht  11.01.16 Hiigelpettuse süüdistuse saanud suurärimees: tegelikult uuritakse, kuidas rahastatakse IRLi ","Kaebaja leiab, et ajakirjaniku üks küsimus on spekulatiivne, sisaldab valeväiteid ja eksitab lugejaid. ",pressinõukogu otsus,pressinõukogu otsus,18.02.16,"ÕIGEKSMÕISTEV:  Päevaleht ei ole eksinud ajakirjanduseetika koodeksi vastu. Tegemist oli intervjuuga ja ajakirjanik esitas selle käigus küsimusi. IRLi puudutav oli intervjueeritava arvamus. Lisaks sai IRL võimaluse vastulauseks, mis avaldati veebis juba samal päeval. ",õigeksmõistev,õigeksmõistev,Eesti Päevaleht,kirjutav meedia,[],0,0,0,0,0,0,0,0,0,0,0,0,0,0,0,0,0,0,0,0,0,0,0,0,0,0,0
620,29.12.15,2015,Hiiu Leht 29.12.15 Koostöökogu juhataja: Kõpu mäss lõppes happy endiga ,"Kaebaja ei ole rahul, et leht avaldas tema arvamuse kooskõlastuseta ning et teda on pealkirjas ja allkirjas omavoliliselt sildistatud ametikohaga. ",pressinõukogu otsus,pressinõukogu otsus,21.01.16,ÕIGEKSMÕISTEV: Hiiu Leht ei rikkunud ajakirjanduseetika koodeksit. Pressinõukogu hinnangul on kaebaja esinenud Facebookis ka Hiidlaste Koostöökogu juhatuse esimehena ning kõik Facebookis olev avalik info on tsiteeritav. Lisaks viitas leht avaldatud artikli all ka Facebookile. ,õigeksmõistev,õigeksmõistev,Hiiu Leht,kirjutav meedia,[],0,0,0,0,0,0,0,0,0,0,0,0,0,0,0,0,0,0,0,0,0,0,0,0,0,0,0
618,15.12.15,2015,"Kanal 2, Radar 01.12.15 Kuidas ärimehed jõuliselt garaaþe üle võtavad ","Kaebajad leiavad, et saatelõik on kallutatud, tugineb ebaõigetele väidetele ja ebausaldusväärsetele allikatele. Kaebajad leiavad, et ei saanud võimalust kommentaariks. ",pressinõukogu otsus,pressinõukogu otsus,21.01.16,"ÕIGEKSMÕISTEV: Kanal 2 ei ole Radaris avaldatud saatelõiguga „Kuidas ärimehed jõuliselt garaaže üle võtavad“ rikkunud ajakirjanduseetika koodeksit. Pressinõukogu hinnangul on saates antud sõna mõlemale konfliktipoolele ja lisaks on võetud ka Tallinna linna esindaja seisukoht, kes kinnitas garaažide jõuga ülevõtmist ja probleeme. Juho Karule pakuti mitmel korral võimalust kommentaariks. Samuti pakuti kommentaari Hannes Raagile, kes ütles, et kommenteerib Juho Karu. Kuna Hannes Raag on Mustamäe Keskuse OÜ juhatuse liige, siis pakuti tema kaudu sõna ka Mustamäe Keskusele. ",õigeksmõistev,õigeksmõistev,Kanal2,rääkiv meedia,[],0,0,0,0,0,0,0,0,0,0,0,0,0,0,0,0,0,0,0,0,0,0,0,0,0,0,0
617,12.12.15,2015,"Elu24, Postimehe veeb 11.12.15 Kaastundeavaldus Eesti naistele! Jaak Madison on suhtes? ","Kaebaja leiab, et artikkel sisaldab tema kohta valefakte ja süüdistust. ",pressinõukogu otsus,pressinõukogu otsus,21.01.16,"ÕIGEKSMÕISTEV: Postimees.ee ei rikkunud ajakirjanduseetika koodeksit. Pressinõukogu leiab, et artiklis avaldatud ahistamissüüdistus põhines varem Postimehe veebis avaldatul, kus Tallink kinnitas, et sisejuurdluse käigus kogutud materjal toetas ettevõtte töötajate väiteid, mille kohaselt Jaak Madison tungis Tallinkis töötades kajutitesse ja ahistas oma naiskolleege. Pressinõukogu hinnangul on Tallinki sisejuurdluse materjal tõendi tähtsusega. ",õigeksmõistev,õigeksmõistev,Postimees,kirjutav meedia,[],0,0,0,0,0,0,0,0,0,0,0,0,0,0,0,0,0,0,0,0,0,0,0,0,0,0,0
616,08.12.15,2015,Äripäev 27.11.15 Õhus veel üks keelatud riigiabi juhtum ,"Kaebaja hinnangul on artikli pealkiri ja juhtlause eksitavad, artikkel sisaldab ebaõigeid fakte ning kaebaja ei ole saanud sõna ega võimalust vastulauseks. ",pressinõukogu otsus,pressinõukogu otsus,21.01.16,"ÕIGEKSMÕISTEV: Äripäev ei ole rikkunud ajakirjanduseetika koodeksit. Pressinõukogu hinnangul ei ole artiklis esitatud Taastuvenergia Koja ega ka selle liikmete kohta süüdistusi, vaid on kirjeldatud olemasolevat probleemi seoses toetustega. Pressinõukogu arvates ei ole artiklis Taastuvenergia Koja liikmeid süüdistatud ebaseadusliku riigiabi saamises. ",õigeksmõistev,õigeksmõistev,Äripäev,kirjutav meedia,[],0,0,0,0,0,0,0,0,0,0,0,0,0,0,0,0,0,0,0,0,0,0,0,0,0,0,0
615,01.12.15,2015,Äripäev 27.11.15 Ossinovski tõmbas pidurit ,"Kaebaja hinnangul on eksitavad artikli veebiversioonis oleva foto allkiri ja paberlehe esikülje pealkiri. Kaebaja leiab, et artiklis ei ole tõestatud kaebaja kohta esitatud fakti, et ta aitab oma juhitava erakonnaga isa. ",pressinõukogu otsus,pressinõukogu otsus,21.01.16,"ÕIGEKSMÕISTEV: Äripäev ei ole eksinud ajakirjanduseetika koodeksi vastu. Pressinõukogu hinnangul on artiklis erinevate osapoolte kommentaarid, samuti antakse sõna Jevgeni Ossinovskile. ",õigeksmõistev,õigeksmõistev,Äripäev,kirjutav meedia,[],0,0,0,0,0,0,0,0,0,0,0,0,0,0,0,0,0,0,0,0,0,0,0,0,0,0,0
614,27.11.15,2015,"Eesti Päevaleht 27.10.15 Torma seamatus joogivett ei riku, seda teevad inimesed ","Kaebaja peab artiklit ühepoolseks. Samuti leiab kaebaja, et artikkel ei põhine tõenditega tagatud infol ning sisaldab oletusi ja valeväiteid. ",pressinõukogu otsus,pressinõukogu otsus,21.01.16,"ÕIGEKSMÕISTEV: Eesti Päevaleht ei ole rikkunud ajakirjanduseetika koodeksit. Pressinõukogu ei näe alust kahelda artiklis avaldatud keskkonnaministeeriumi esindaja sõnades ja peab allikat usaldusväärseks. Pressinõukogu hinnangul ei ole Torma vallavalitsus antud loo kontekstis osapool, kellelt oleks pidanud kommentaari võtma, sest vallavalitsus ei vastuta erakaevude eest. ",õigeksmõistev,õigeksmõistev,Eesti Päevaleht,kirjutav meedia,[],0,0,0,0,0,0,0,0,0,0,0,0,0,0,0,0,0,0,0,0,0,0,0,0,0,0,0
612,27.11.15,2015,Eesti Päevaleht 19.11.15 Vegandieedist tekkinud tervisekahjustused on jõudnud Eesti lasteni ,"Kaebaja hinnangul on artiklis ebaõiged faktid ja tema teemapüstitus on kontekstist välja rebitud. Samuti ei ole kaebaja rahul, et jätkuloos on tema infot valesti kajastatud. ",pressinõukogu otsus,pressinõukogu otsus,21.01.16,"ÕIGEKSMÕISTEV: Leht ei eksinud ajakirjanduseetika koodeksi vastu. Pressinõukogu hinnangul olid artiklites kasutatud näited anonüümsed ja need illustreerisid põhiteemat, st veganlusega kaasnevaid terviseprobleeme. Pressinõukogu hinnangul oli Facebooki grupist võetud info kasutamine põhjendatud, sest kuigi grupp oli suletud, siis sai liituda ja infot koguda iga Facebooki kasutaja. Info hankimine sellisel viisil oli Pressinõukogu arvates avalikkuse huvi seisukohalt põhjendatud, sest tegemist on ühiskonnas olulise probleemiga. ",õigeksmõistev,õigeksmõistev,Eesti Päevaleht,kirjutav meedia,[],0,0,0,0,0,0,0,0,0,0,0,0,0,0,0,0,0,0,0,0,0,0,0,0,0,0,0
610,17.11.15,2015,Saarte Hääl 05.09.15 Maaomanikud viisid Pakulaiu külarahva eest peitu ,"Kaebaja kohta on esitatud süüdistusi, kuid sõna antud ei ole. Kaebaja leiab, et leht ei ole kontrollinud fakte ega allikaid. ",pressinõukogu otsus,pressinõukogu otsus,17.12.15,"ÕIGEKSMÕISTEV: Leht ei eksinud ajakirjanduseetika koodeksi punktide vastu. Artiklis on nii Ly Humala arvamus kui ka Valdeko Humala esindaja Roman Humala kommentaar. Pressinõukogu leiab, et ajakirjanikul ei olnud põhjust kahelda, et Roman Humal on Valdeko Humala esindaja. Lisaks informeeris ajakirjanik lehe väitel mõlemat, et soovib saada kontakti Valdeko Humalaga. ",õigeksmõistev,õigeksmõistev,Saarte Hääl,kirjutav meedia,[],0,0,0,0,0,0,0,0,0,0,0,0,0,0,0,0,0,0,0,0,0,0,0,0,0,0,0
609,16.11.15,2015,MK-Estonia 21.10.15 Naisi keelitatakse ostma kallist kosmeetikat: kas tegu on pettusega või mitte - MK-Estonia selgitab ,"Kaebaja leiab, et artikkel on negatiivse varjundiga ja sisaldab valefakte. Samuti peab kaebaja eksitavaks artikli pealkirja. ",pressinõukogu otsus,pressinõukogu otsus,17.12.15,"ÕIGEKSMÕISTEV: MK-Estonia ei ole rikkunud ajakirjanduseetika koodeksit. Pressinõukogu hinnangul ei ole artikli pealkiri ja juhtlõik eksitavad, sest vastavad loo sisule. Artikkel sisaldab erinevate osapoolte kommentaare ja DeSheli esindajad on saanud oma seisukoha avaldada. ",õigeksmõistev,õigeksmõistev,MK-Estonia,kirjutav meedia,[],0,0,0,0,0,0,0,0,0,0,0,0,0,0,0,0,0,0,0,0,0,0,0,0,0,0,0
608,16.11.15,2015,Meie Maa 22.10.15 Kehv praamiliiklus sundis mõisa maha müüma ,"Kaebaja leiab, et avaldatud info ei ole tõene, pealkiri on eksitav, infot ei kontrollitud ja kaebajale ei antud sõna. ",pressinõukogu otsus,pressinõukogu otsus,17.12.15,"ÕIGEKSMÕISTEV: Meie Maa ei ole rikkunud ajakirjanduseetika koodeksit. Pressinõukogu hinnangul tuleb artiklist välja, et hoone üheks müümise põhjuseks on kehv praamiliiklus ja seega ei ole artikli pealkiri eksitav. Pressinõukogu hinnangul on artikkel kinnisvara müügi kohta ja seepärast ei olnud lehel põhjust küsida Väinamere Liinide kommentaari. ",õigeksmõistev,õigeksmõistev,Meie Maa,kirjutav meedia,[],0,0,0,0,0,0,0,0,0,0,0,0,0,0,0,0,0,0,0,0,0,0,0,0,0,0,0
607,09.11.15,2015,Sakala 31.10.15 Kiin ja Under muutuvas raamatukogus ,"Kaebaja hinnangul on artikkel ühekülgne, pealiskaudne ja põhjendamatult negatiivne. Kaebaja ei ole rahul, et tema esimene vastulause avaldati kärbitult ja temaga kooskõlastamata ning teist vastulauset ei avaldatud. ",pressinõukogu otsus,pressinõukogu otsus,17.12.15,"ÕIGEKSMÕISTEV: Sakala ei eksinud ajakirjanduseetika koodeksi vastu. Pressinõukogu hinnangul on artikli puhul tegemist kultuurisündmuse arvustusega, mis lubab ajakirjanikul oma arvamust väljendada. Pressinõukogu hinnangul sai Sirje Kiin oma vastulauses piisavalt leheruumi oma seisukoha avaldamiseks. ",õigeksmõistev,õigeksmõistev,Sakala,kirjutav meedia,[],0,0,0,0,0,0,0,0,0,0,0,0,0,0,0,0,0,0,0,0,0,0,0,0,0,0,0
605,03.11.15,2015,Raadio Kuku 09.10.15 Kirillitsas Eesti ,"Kaebaja hinnangul sisaldas saade valeväiteid. Kaebaja ei ole rahul, et tema vastulauset ei avaldatud. ",pressinõukogu otsus,pressinõukogu otsus,19.11.15,"ÕIGEKSMÕISTEV: Kuku ei ole eksinud ajakirjanduseetika koodeksi vastu. Pressinõukogu hinnangul ei kõlanud saates tsitaate, vaid nende tõlgendused. Samuti avaldasid saatejuht ja külalised raamatu kohta oma arvamust. ",õigeksmõistev,õigeksmõistev,Kuku Raadio,rääkiv meedia,[],0,0,0,0,0,0,0,0,0,0,0,0,0,0,0,0,0,0,0,0,0,0,0,0,0,0,0
602,23.10.15,2015,Meie Maa 12.10.15 Ennetähtaegselt vangist vabastatud Liis Haavel astub jälle kohtu ette ,"Kaebaja hinnangul on artikkel ja pealkiri eksitavad ja temast on loodud vale pilt. Kaebaja ei ole rahul, et talle sõna ei antud. ",pressinõukogu otsus,pressinõukogu otsus,19.11.15,"ÕIGEKSMÕISTEV: Meie Maa ei ole rikkunud ajakirjanduseetika koodeksit. Pressinõukogu hinnangul ei ole artikkel eksitav ega jäta muljet, nagu oleks kaebaja sooritanud uue kuriteo. Artiklist tuleb välja ka kohtusse mineku põhjus. ",õigeksmõistev,õigeksmõistev,Meie Maa,kirjutav meedia,[],0,0,0,0,0,0,0,0,0,0,0,0,0,0,0,0,0,0,0,0,0,0,0,0,0,0,0
601,23.10.15,2015,Saarte Hääl 10.10.15 Ennetähtaegselt vangist vabastatud Liis Haavel astub jälle kohtu ette ,"Kaebaja hinnangul eksitavad artikkel ja selle pealkiri lugejaid. Kaebaja ei ole rahul, et talle sõna ei antud. ",pressinõukogu otsus,pressinõukogu otsus,19.11.15,"ÕIGEKSMÕISTEV: Saarte Hääl ei ole rikkunud ajakirjanduseetika koodeksit. Pressinõukogu hinnangul ei ole artikli pealkiri eksitav. Pressinõukogu hinnangul ei jäta artikkel ka muljet, nagu oleks kaebaja sooritanud uue kuriteo. Artiklist tuleb välja kohtusse mineku põhjus. ",õigeksmõistev,õigeksmõistev,Saarte Hääl,kirjutav meedia,[],0,0,0,0,0,0,0,0,0,0,0,0,0,0,0,0,0,0,0,0,0,0,0,0,0,0,0
600,23.10.15,2015,Eesti Ekspress 15.10.15 Enne läheb Jumala päike looja kui ... Liis Haaveli vemburegister ,"Kaebaja hinnangul on artikli pealkiri, foto ja fotoallkiri eksitavad. Kaebaja ei ole rahul, et ta sõna ei saanud. ",pressinõukogu otsus,pressinõukogu otsus,19.11.15,"ÕIGEKSMÕISTEV: Eesti Ekspress ei ole rikkunud ajakirjanduseetika koodeksit. Pressinõukogu hinnangul ei oma kohtumaja nimi pildiallkirjas kogu artikli seisukohast olulist tähtsust ja seega ei eksita lugejaid. Samuti ei pea Pressinõukogu eksitavaks artikli pealkirja, sest tegemist on Liis Haaveli avalikkusele teadaolevate kuritegude loeteluga. ",õigeksmõistev,õigeksmõistev,Eesti Ekspress,kirjutav meedia,[],0,0,0,0,0,0,0,0,0,0,0,0,0,0,0,0,0,0,0,0,0,0,0,0,0,0,0
599,23.10.15,2015,Õhtuleht 09.10.15 Ennetähtaegselt vangist vabastatud Liis Haavel astub jälle kohtu ette ,"Kaebaja leiab, et artikli pealkiri, foto ja rubriik ""Krimi"" eksitavad auditooriumi. Kaebaja ei ole rahul, et talle sõna ei antud. Samuti sisaldab artikkel valeväiteid, leiab kaebaja. ",pressinõukogu otsus,pressinõukogu otsus,19.11.15,"ÕIGEKSMÕISTEV: Õhtuleht ei ole rikkunud ajakirjanduseetika koodeksit. Pressinõukogu hinnangul ei ole avaldatud materjal ega ka foto eksitavad. Samuti 9. oktoobri artikli esitamine krimiuudiste rubriigis. Pressinõukogu hinnangul ei jäta avaldatu muljet, nagu oleks kaebaja sooritanud uue kuriteo. Lugudest tuleb välja ka kohtusse mineku põhjus. ",õigeksmõistev,õigeksmõistev,Õhtuleht,kirjutav meedia,[],0,0,0,0,0,0,0,0,0,0,0,0,0,0,0,0,0,0,0,0,0,0,0,0,0,0,0
598,23.10.15,2015,Delfi 09.10.15 Ennetähtaegselt vangist vabastatud pettur Liis Haavel astub jälle kohtu ette ,"Kaebaja hinnangul on artikli pealkiri, foto ja video eksitavad. Samuti sisaldab artikkel valeväiteid ja kaebaja ei saanud sõna. ",pressinõukogu otsus,pressinõukogu otsus,19.11.15,"ÕIGEKSMÕISTEV: Delfi ei ole rikkunud ajakirjanduseetika koodeksit. Pressinõukogu hinnangul ei ole artikli pealkiri, foto ega video eksitavad. Pressinõukogu hinnangul ei jäta artikkel muljet, nagu oleks kaebaja sooritanud uue kuriteo. Artiklist tuleb välja ka kohtusse mineku põhjus. ",õigeksmõistev,õigeksmõistev,Delfi,kirjutav meedia,[],0,0,0,0,0,0,0,0,0,0,0,0,0,0,0,0,0,0,0,0,0,0,0,0,0,0,0
594,15.10.15,2015,Eesti Päevaleht 09.10.15 Riigikogu kantselei võitleb endiselt salvestiste arhiveerimise vastu ,Kaebaja hinnangul on artiikkel ja selle pealkiri eskitavad. Samuti on artiklis segamini faktid ja oletused. ,pressinõukogu otsus,pressinõukogu otsus,19.11.15,"ÕIGEKSMÕISTEV: Päevaleht ei ole rikkunud ajakirjanduseetika koodeksit. Pressinõukogu hinnangul ei ole artikli pealkiri eksitav, sest tegelikkuses on Riigikogu kantselei salvestiste arhiveerimise vastu, mis tuleb välja Riigikogu kantselei kirjast. Pressinõukogu hinnangul ei oma antud kontekstis tähtsust kas ollakse sisuliselt arhiveerimise vastu või on põhjuseks raha puudus. ",õigeksmõistev,õigeksmõistev,Eesti Päevaleht,kirjutav meedia,[],0,0,0,0,0,0,0,0,0,0,0,0,0,0,0,0,0,0,0,0,0,0,0,0,0,0,0
592,07.10.15,2015,Postimees 06.10.15 EKRE kasutab Kremli propagandatrikke: vanad kaadrid serveeritakse uute pähe ,"Kaebaja hinnangul pole Postimees kontrollinud info tõestust. Kaebaja leiab, et artikkel sisaldab eksitavat infot ja erakonna esindaja ei saanud sõna. ",pressinõukogu otsus,pressinõukogu otsus,19.11.15,"ÕIGEKSMÕISTEV: Postimees ei ole rikkunud ajakirjanduseetika koodeksit. Pressinõukogu leiab, et tegemist on refereeringuga, kus sõna on saanud mõlemad pooled. Pressinõukogu hinnangul ei ole Martin Helme kommentaari kuidagi naeruvääristatud. Samuti on Pressinõukogu hinnangul põhjendatud artikli pealkiri. ",õigeksmõistev,õigeksmõistev,Postimees,kirjutav meedia,[],0,0,0,0,0,0,0,0,0,0,0,0,0,0,0,0,0,0,0,0,0,0,0,0,0,0,0
587,01.09.15,2015,Eesti Ekspress 26.08.15 Selle suve vägistamisafäär ,Kaebaja hinnangul sisaldab artikkel koos kõrvallooga hulgaliselt valefakte ning tekitab talle sellega kahju. ,pressinõukogu otsus,pressinõukogu otsus,22.10.15,"ÕIGEKSMÕISTEV: Leht ei eksinud ajakirjanduseetika koodeksi vastu. Pressinõukogu hinnangul tugines leht politsei kirjalikule materjalile, milles pole alust kahelda. Lisaks pakkus toimetus Triin Tulevile võimalust kommentaariks, millest kaebaja aga keeldus. Pressinõukogu käsitleb Triin Tulevit avaliku elu tegelasena, sest ta on osalenud teleseriaalis ja on korduvalt eksponeerinud enda isikut avalikkuses. Sellest tulenevalt on tema puhul ka ajakirjanduse tavalisest suurem tähelepanu ja kriitika õigustatud. ",õigeksmõistev,õigeksmõistev,Eesti Ekspress,kirjutav meedia,[],0,0,0,0,0,0,0,0,0,0,0,0,0,0,0,0,0,0,0,0,0,0,0,0,0,0,0
585,16.07.15,2015,Delovõje Vedomosti 19.06.15 BLRT Grupp lõpetas 2014. aasta kasumlikult ,"Kaebaja hinnangul on artikli juures olev foto eksitav, negatiivse alatooniga ja mainet kahjustav. ",pressinõukogu otsus,pressinõukogu otsus,17.09.15,ÕIGEKSMÕISTEV: Delovõje Vedomosti ei ole eksinud ajakirjanduseetika koodeksi vastu. Pressinõukogu ei leia foto kasutamisel pahatahtlikkust ega lugeja eksitamist. ,õigeksmõistev,õigeksmõistev,Delovõje Vedomosti,kirjutav meedia,[],0,0,0,0,0,0,0,0,0,0,0,0,0,0,0,0,0,0,0,0,0,0,0,0,0,0,0
584,08.07.15,2015,"Eesti Ekspress 08.04.15 Teel võlaorjusse. Mis saab Eesti stiilseimaks meheks valitud ekspankurist?, Ärieliidi pankur ja võlaorjus?, Eesti rikkaid pügati nagu lolle lambaid ","Kaebaja ei ole rahul, et ta ei saanud võimalust kommentaariks ja vastulauseks. Samuti leiab kaebaja, et info tõesust ja allikate usaldusväärsust ei ole kontrollitud. ",pressinõukogu otsus,pressinõukogu otsus,17.09.15,ÕIGEKSMÕISTEV: Eesti Ekspress ei ole eksinud ajakirjanduseetika koodeksi vastu. Pressinõukogu hinnangul on Tõnis Haavelile pakutud võimalust kommentaariks. ,õigeksmõistev,õigeksmõistev,Eesti Ekspress,kirjutav meedia,[],0,0,0,0,0,0,0,0,0,0,0,0,0,0,0,0,0,0,0,0,0,0,0,0,0,0,0
582,01.07.15,2015,Postimees ,"Kaebaja leiab, et artikkel hävitab ta maine, ta ei ole sõna saanud ja artikkel sisisladab kinnitamata väiteid. ",pressinõukogu otsus,pressinõukogu otsus,17.09.15,"ÕIGEKSMÕISTEV: Postimees ei ole eksinud ajakirjanduseetika koodeksi vastu, sest ei ole artiklis osapoolte nimesid ega nendega seotud üksikasju avaldanud. Postimehe artiklite puhul on tegemist kohtuotsuse kajastamisega ja taustainfoga kaebaja kohta. ",õigeksmõistev,õigeksmõistev,Postimees,kirjutav meedia,[],0,0,0,0,0,0,0,0,0,0,0,0,0,0,0,0,0,0,0,0,0,0,0,0,0,0,0
