322,09.12.10,2010,Maaleht 09.12.10 Werol võlgneb põllumeestele rapsi eest kümneid miljoneid ,"Kaebaja leiab, et artiklis on esitatud valeinfot Werol Tehaste kohta ja allikaid on kuritarvitatud. ",pressinõukogu otsus,pressinõukogu otsus,20.01.11,"ÕIGEKSMÕISTEV: Maaleht ei eksinud Werolist kirjutades ajakirjanduseetika koodeksi vastu. Pressinõukogu leiab, et lehel ei olnud põhjust erinevate allikate väidetes ja kompetentsuses kahelda. Pressinõukogu hinnangul sai Meelis Virro piisavas mahus sõna süüdistuste kommenteerimiseks ja ümber lükkamiseks ning artiklis tunnistab ta ka ise maksetähtaegadest mitte kinni pidamist, kui nimetab seda ajutiseks. ",õigeksmõistev,õigeksmõistev,Maaleht,kirjutav meedia,[],0,0,0,0,0,0,0,0,0,0,0,0,0,0,0,0,0,0,0,0,0,0,0,0,0,0,0
318,19.11.10,2010,Den za Dnjom 21.08.10 Nüride kääride jälgedes ,"Kaebaja leiab, et artikliga on kahjustatud tema ja ta kooli nime ja mainet ning artikkel on ühekülgne. ",pressinõukogu otsus,pressinõukogu otsus,20.01.11,"ÕIGEKSMÕISTEV: Den za Dnjom ei eksinud ajakirjanduseetika koodeksi vastu. Pressinõukogu leiab, et artiklis esitatud info toetub selgetele allikatele, konflikti osapooled said artiklis sõna ja lehel oli avalik huvi seda teemat käsitleda. Leht võis kaebaja vastulause tagasi lükata, juhul kui see ei sisaldanud uut infot ja ei tegelenud artiklis sisalduvate ekslike faktiväidete või tsitaatide parandamisega. ",õigeksmõistev,õigeksmõistev,Den za Dnjom,kirjutav meedia,[],0,0,0,0,0,0,0,0,0,0,0,0,0,0,0,0,0,0,0,0,0,0,0,0,0,0,0
316,26.10.10,2010,Eesti Ekspress 16.09.10 Kris Taska ei taha palka maksta ,"Kaebaja hinnangul on artikkel moonutatud, ei vasta tegelikkusele ja sisaldab faktivigu. Samuti ei ole kaebaja rahul, et lehe veebis tema seisukohti ei avaldatud. ",pressinõukogu otsus,pressinõukogu otsus,09.12.10,"ÕIGEKSMÕISTEV: Eesti Ekspress ei eksinud antud artiklis ajakirjanduseetika koodeksi punktide 1.5., 4.1., 4.2., 3.5. ja 5.1. vastu, nagu väidab kaebaja. Kaebaja ei osuta konkreetsetele faktivigadele ning on saanud artiklis esitatud etteheidete osas piisaval määral sõna. Pressinõukogu hinnangul on lehel kinnitusi filmitegijatele maksmata arvete ja töötasude kohta, et anda alust sellest kirjutamiseks. ",õigeksmõistev,õigeksmõistev,Eesti Ekspress,kirjutav meedia,"['1.5', '4.1', '4.2', '3.5', '5.1']",0,0,1,0,0,0,0,0,1,0,0,1,1,0,0,0,0,0,0,0,0,0,1,0,0,0,5
312,30.09.10,2010,Õhtuleht ,"Kaebaja leiab, et ohvri identifitseerimine ei ole põhjendatud ning artikliga on leht põhjustanud omastele kannatusi. ",pressinõukogu otsus,pressinõukogu otsus,18.11.10,"ÕIGEKSMÕISTEV: Õhtuleht ei rikkunud head ajakirjandustava ning jäi ohvrist kirjutades ajakirjanduseetika koodeksi punkti 4.8. piiresse, mis näeb ette, et ohvreid üldjuhul avalikkuse jaoks ei identifitseerita. Pressinõukogu hinnangul saab ohvrit tema eesnime ja mõne eluloolise fakti järgi tuvastada vaid väike ring inimesi ja seda ei pea lugema tema identifitseerimiseks avalikkuse jaoks. ",õigeksmõistev,õigeksmõistev,Õhtuleht,kirjutav meedia,['4.8'],0,0,0,0,0,0,0,0,0,0,0,0,0,0,0,0,0,1,0,0,0,0,0,0,0,0,1
310,18.08.10,2010,Eesti Päevaleht 12.08.10 Igor Gräzini räpase sõja tegelikud tagamaad ,"Kaebaja ei ole rahul, et väljaanne tema artikli peale avaldamist hoiatuseta kustutas. Kaebaja leiab, et sellega on ajakirjanik rikkunud infoallikale antud lubadust. ",pressinõukogu otsus,pressinõukogu otsus,21.10.10,ÕIGEKSMÕISTEV: Eesti Päevaleht ei eksinud artiklit oma veebiväljaandest kustutades ajakirjanduseetika koodeksi vastu. Pressinõukogu hinnangul on igal toimetusel õigus otsustada arvamusartiklite avaldamise sobivuse üle oma väljaandes ja seda ei saa pidada sõnavabaduse piiramiseks. ,õigeksmõistev,õigeksmõistev,Eesti Päevaleht,kirjutav meedia,[],0,0,0,0,0,0,0,0,0,0,0,0,0,0,0,0,0,0,0,0,0,0,0,0,0,0,0
307,23.07.10,2010,Põhjarannik 17.06.10 Koeratapja kohtu all ,"Kaebaja ei ole rahul, et leht on ta enne kohtuotsust süüdi mõistnud. Samuti ei ole kaebaja rahul, et temaga ei räägitud ning leht ei kontrollinud faktide tõesust. ",pressinõukogu otsus,pressinõukogu otsus,13.09.10,"ÕIGEKSMÕISTEV: Põhjarannik ei ole eksinud ajakirjanduseetika koodeksi vastu. Leht tugines oma artiklis uurimisorganite materjalidele ja kohtu otsusele hoida kaebajat vahi all. Vahi all viibija kui konflikti osapoole kommentaari saada ei olnud reaalne. Pressinõukogu leiab ka, et leht ei ole rikkunud artikli pealkirjas süütuse presumptsiooni põhimõtet, kuna kaebaja isik ei ole artiklis tuvastatav. ",õigeksmõistev,õigeksmõistev,Põhjarannik,kirjutav meedia,[],0,0,0,0,0,0,0,0,0,0,0,0,0,0,0,0,0,0,0,0,0,0,0,0,0,0,0
296,07.04.10,2010,Eesti Ekspress 21.01.10 Ärimees kavandab superkalmistut ,"Kaebajate hinnangul on artiklis nende kohta avaldatud info vale ja kontrollimata. Samuti ei ole kaebajad rahul, et neile ei antud sõna. ",pressinõukogu otsus,pressinõukogu otsus,20.05.10,"ÕIGEKSMÕISTEV: Kaebajate kohta ei ole artiklis esitatud süüdistusi, mis nõuaks asjaosalistelt selgitusi. ",õigeksmõistev,õigeksmõistev,Eesti Ekspress,kirjutav meedia,[],0,0,0,0,0,0,0,0,0,0,0,0,0,0,0,0,0,0,0,0,0,0,0,0,0,0,0
295,11.03.10,2010,Äripäev 04.03.10 Kohustuslik e-aruandlus ettevõtjate turmtule all ,Kaebaja hinnangul on artikli alapealkirjad ja juhtlaused eksitavad ja sisaldavad valefakte ning artikkel sisaldab eksitavat infot. ,pressinõukogu otsus,pressinõukogu otsus,22.04.10,"ÕIGEKSMÕISTEV: Pressinõukogu hinnangul tuginevad nii esikülje kui ka artikli pealkiri artiklis kajastatud allikate tsitaatidele ja faktidele. Probleemne on küll vahepealkiri „Raamatupidajad töötavad ilma juhendita“, minnes vastuollu artiklis viidatud tõigaga, et juhend on siiski olemas, kuid raamatupidajad ei ole sellega rahul. Pressinõukogu hinnangul on kõigi osapoolte kommentaarid artiklis mahu osas tasakaalus. ",õigeksmõistev,õigeksmõistev,Äripäev,kirjutav meedia,[],0,0,0,0,0,0,0,0,0,0,0,0,0,0,0,0,0,0,0,0,0,0,0,0,0,0,0
291,03.03.10,2010,Õhtuleht online 08.12.10 Kohus käsib Jaan Kundlal vihavaenlasele ligi 7000 krooni maksta ,Kaebaja hinnangul on artikkel vale ja laimav. ,pressinõukogu otsus,pressinõukogu otsus,22.04.10,"ÕIGEKSMÕISTEV: Pressinõukogu leiab, et artiklis on selgesti näha, et Jaan Kundlaga on räägitud ning seega on Jaan Kundla Kuma raadio vahendusel sõna saanud. Vastulauset aga Jaan Kundla Õhtulehelt ei taotlenud. Pressinõukogu hinnangul ei saa pidada eksitavaks sõna „vihavaenlane“ kasutamist pealkirjas, sest seda kinnitavad kahe mehe vahelised arvukad kohtuvaidlused. ",õigeksmõistev,õigeksmõistev,Õhtuleht,kirjutav meedia,[],0,0,0,0,0,0,0,0,0,0,0,0,0,0,0,0,0,0,0,0,0,0,0,0,0,0,0
290,03.03.10,2010,Järva Teataja online 07.12.09 Kohus käsib Jaan Kundlal vihavaenlasele 7000 krooni maksta ,"Kaebaja hinnangul on artikkel vale ja laimav. Kaebaja leiab, et artikliga on väljanne eksinud ajakirjanduseetika koodeksi 11 erineva punkti vastu. ",pressinõukogu otsus,pressinõukogu otsus,22.04.10,"ÕIGEKSMÕISTEV: Pressinõukogu leiab, et artiklis on selgesti näha, et Jaan Kundlaga on räägitud ning seega on Jaan Kundla Kuma raadio vahendusel sõna saanud. Vastulauset aga Jaan Kundla Järva Teatajalt 7. detsembril 2009 online´is avaldatud uudisele ei taotlenud. Pressinõukogu hinnangul ei saa pidada eksitavaks sõna „vihavaenlane“ kasutamist pealkirjas, sest seda kinnitavad kahe mehe vahelised arvukad kohtuvaidlused. ",õigeksmõistev,õigeksmõistev,Järva Teataja,kirjutav meedia,[],0,0,0,0,0,0,0,0,0,0,0,0,0,0,0,0,0,0,0,0,0,0,0,0,0,0,0
279,25.11.09,2009,Eesti Päevaleht ,"Kaebaja hinnangul sisaldab artikkel ebatäpset, eksitavat ja moonutatud infot. Kaebaja ei ole rahul, et osa tema antud infost on jäetud avaldamata ning artikkel on seega kallutatud. ",pressinõukogu otsus,pressinõukogu otsus,21.01.10,"ÕIGEKSMÕISTEV: Leht ei eksinud eetikakoodeksi vastu, sest kaebaja on artiklis piisavalt ja proportsionaalselt sõna saanud. Pressinõukogu hinnangul ei pakkunud leht kaebajale vastulauset, sest kaebaja ei avaldanud vastavat soovi ega osutanud toimetuse tähelepanu väidetavatele eksimustele. ",õigeksmõistev,õigeksmõistev,Eesti Päevaleht,kirjutav meedia,[],0,0,0,0,0,0,0,0,0,0,0,0,0,0,0,0,0,0,0,0,0,0,0,0,0,0,0
271,08.10.09,2009,Eesti Rahvusringhääling 29.09.09 Evelin Ilvese intervjuu saates Ringvaade ,"Kaebaja soovib hinnangut, milline on kanali vastutus otsesaates Evelin Ilvesega toimunud intervjuu puhul, kus intervjueeritav süüdistas kaebajat põhjendamatult valetamises ning kahjustas sellega kaebaja mainet ja usaldusväärsust ajakirjanikuna. ",pressinõukogu otsus,pressinõukogu otsus,29.10.09,"ÕIGEKSMÕISTEV: Rahvusringhääling ei ole eksinud ajakirjanduseetika koodeksi vastu, sest on teinud kõik, et Priit Pulleritsule enda kaitseks sõna anda. Priit Pullerits sai oma seisukoha esitada raadiosaates. ",õigeksmõistev,õigeksmõistev,ERR,rääkiv meedia,[],0,0,0,0,0,0,0,0,0,0,0,0,0,0,0,0,0,0,0,0,0,0,0,0,0,0,0
263,21.08.09,2009,Eesti Rahvusringhääling 19.08.09 Aktuaalne Kaamera ,"Kaebaja hinnangul sisladab uudislõik isiklikke arvamusi ja oletusi faktide pähe, selles on eksitud tasakaalustatuse põhimõtte vastu. ",pressinõukogu otsus,pressinõukogu otsus,08.10.09,"ÕIGEKSMÕISTEV: Pressinõukogu hinnangul on uudislõik tasakaalustatud ning sõna on antud nii ERSP Taasasutava Kogu kritiseerijatele kui ka selle loojatele. Pressinõukogu hinnangul ei ole uudises segamini faktid ja oletused, sest uudis põhineb konkreetsetel allikatel ning uudislõigu autor vahendab vaid allikate sõnu ning ei avalda isiklikku arvamust. ",õigeksmõistev,õigeksmõistev,ERR,rääkiv meedia,[],0,0,0,0,0,0,0,0,0,0,0,0,0,0,0,0,0,0,0,0,0,0,0,0,0,0,0
260,04.08.09,2009,Den za Dnjom 12.06.09 Venemaale kursi 1:15 järgi ,"Kaebaja ei ole rahul, et artiklis esitatud süüdistustele pole võetud kommentaare, artikkel sisaldab eksitavat infot ning uudised, arvamused ja oletused on segamini. ",pressinõukogu otsus,pressinõukogu otsus,29.10.09,"ÕIGEKSMÕISTEV: Leht ei eksinud ajakirjanduseetika koodeksi vastu, sest kaebaja on artiklis piisavalt ja proportsionaalselt sõna saanud, artiklis on kasutatud mitmeid allikaid ning väited on faktidega kaetud. Pressinõukogu taunib kaebaja välimust puudutava tsitaadi avaldamist ning leiab, et see oli põhjendamatult halvustav. ",õigeksmõistev,õigeksmõistev,Den za Dnjom,kirjutav meedia,[],0,0,0,0,0,0,0,0,0,0,0,0,0,0,0,0,0,0,0,0,0,0,0,0,0,0,0
256,21.07.09,2009,Eesti Päevaleht online 14.07.09 Telekanal Seitse võib ringhäälinguloast ilma jääda ,"Kaebaja leiab, et artikli pealkiri on eksitav. Artikkel sisaldab kaebaja hinnangul faktivigu ning tekitab firmale kahju. ",pressinõukogu otsus,pressinõukogu otsus,27.08.09,"ÕIGEKSMÕISTEV: Leht tugines Eesti Autorite Ühingu infole, mida vastaspool keeldus kommenteerimast. Pressinõukogu pädevuses ei ole uudises esitatud faktide tõesust kontrollida. ",õigeksmõistev,õigeksmõistev,Eesti Päevaleht,kirjutav meedia,[],0,0,0,0,0,0,0,0,0,0,0,0,0,0,0,0,0,0,0,0,0,0,0,0,0,0,0
252,30.06.09,2009,Sakala 07.05.09 Palaviku ja kõrvavaluga pisitüdruk ootas õiget ravi päevade kaupa ,Kaebaja hinnangul sisaldab artikkel kontrollimata fakte ja moonutatud sündmuste kronoloogiat ning SA Viljandi Haiglalt ei ole võetud ametlikku kommentaari. ,pressinõukogu otsus,pressinõukogu otsus,27.08.09,"ÕIGEKSMÕISTEV: Kuigi artiklis eksiti ühe kuupäevaga, ei pea Pressinõukogu seda kronoloogilist faktiviga antud artikli seisukohast nii oluliseks, et leht hukka mõista. Pressinõukogu leiab, et leht oleks võinud ema poolt öeldud kuupäevad siiski üle kontrollida. ",õigeksmõistev,õigeksmõistev,Sakala,kirjutav meedia,[],0,0,0,0,0,0,0,0,0,0,0,0,0,0,0,0,0,0,0,0,0,0,0,0,0,0,0
239,05.03.09,2009,päevaleht ,"Kaebaja ei ole rahul, et vaatamata ta keelule avaldati artiklis tema nimi ja foto. ",pressinõukogu otsus,pressinõukogu otsus,06.05.09,"ÕIGEKSMÕISTEV: Olemasoleva info põhjal ei saa tuvastada hea ajakirjandustava rikkumist. Pressinõukogu soovitab allikatel ja toimetustel kategoorilised nõudmised (viitamine, fotografeerimine) eelnevalt kokku leppida e-kirjaga. ",õigeksmõistev,õigeksmõistev,muu väljaanne,muu meedia,[],0,0,0,0,0,0,0,0,0,0,0,0,0,0,0,0,0,0,0,0,0,0,0,0,0,0,0
236,18.02.09,2009,Kanal 2 Reporter 11.02.09 Hull ahistamislugu Lasnamäel ,"Kaebaja leiab, et saatelõigus on moonutatud fakte, teda laimatud ning jäetud esitamata tema arvamus. ",pressinõukogu otsus,pressinõukogu otsus,19.03.09,"ÕIGEKSMÕISTEV: Kaebajale anti sõna ning video kasutamist lubas kaebaja oma kirjaga toimetusele. Pressinõukogu leiab, et toimetusel oli kohustus teemat laiendada ning hankida lisainfot. ",õigeksmõistev,õigeksmõistev,Kanal2,rääkiv meedia,[],0,0,0,0,0,0,0,0,0,0,0,0,0,0,0,0,0,0,0,0,0,0,0,0,0,0,0
233,11.02.09,2009,Kanal 2 Reporter 10.02.09 Inimjahiluba Loo metsas: sihikule võeti salakütid ,Kaebaja hinnangul on loos kasutatud videolõiku metssea piinamisest originaalist erinevas kontekstis ning näidatud jahimehi halvas valguses. ,pressinõukogu otsus,pressinõukogu otsus,19.03.09,"ÕIGEKSMÕISTEV: Pressinõukogu leiab, et video näitamine uudise sissejuhatuses on põhjendatud ja ei ole kontekstiväline. Pressinõukogu hinnangul ei ole tegu kontrollimata materjali avaldamisega. ",õigeksmõistev,õigeksmõistev,Kanal2,rääkiv meedia,[],0,0,0,0,0,0,0,0,0,0,0,0,0,0,0,0,0,0,0,0,0,0,0,0,0,0,0
228,29.12.08,2008,Eesti Ekspress 23.12.08 Areeni aabits ,Kaebaja sõnul sisaldab artikkel tema kohta valefakti ja kahjustab tema mainet Eesti vastupidavusalade harrastajate silmis. Kaebaja kinnitusel ei ole ta kunagi võistelnud rulluisutamises ega ka Evelin Ilvesega ning seega ole talle ka rulluisurajal alla jäänud. ,pressinõukogu otsus,pressinõukogu otsus,22.01.09,"ÕIGEKSMÕISTEV:  Pressinõukogu hinnangul on avaldatu puhul tegemist satiirilises võtmes esitatud hinnangute kogumiga, mille kohta ei saa rakendada uudisteajakirjandusele omast faktide järgimise vajadust. ",õigeksmõistev,õigeksmõistev,Eesti Ekspress,kirjutav meedia,[],0,0,0,0,0,0,0,0,0,0,0,0,0,0,0,0,0,0,0,0,0,0,0,0,0,0,0
226,05.12.08,2008,Õhtuleht 04.12.08 Kapoti-Kalev verises kõrtsikakluses ,"Kaebaja leiab, et artikkel jätab temast Eesti rahvale vale mulje. ",pressinõukogu otsus,pressinõukogu otsus,22.01.09,"ÕIGEKSMÕISTEV: Õhtuleht ei ole eksinud ajakirjanduseetika koodeksi vastu. Õhtuleht on artiklis andnud sõna mõlemale osapoolele, samuti avaldas leht Kalev Rebase kirja. ",õigeksmõistev,õigeksmõistev,Õhtuleht,kirjutav meedia,[],0,0,0,0,0,0,0,0,0,0,0,0,0,0,0,0,0,0,0,0,0,0,0,0,0,0,0
224,10.11.08,2008,"Sirp 31.10.08 Fantastiline algus ja suurepärane lõpp, aga ... ","Kaebaja ei ole rahul, et Sirp nimetab kontserdiagentuuri tegevust ebaeetiliseks ja hinnapoliitikat ebakorrektseks. Kaebaja leiab, et artikkel kahjustab nende mainet. ",pressinõukogu otsus,pressinõukogu otsus,16.12.08,"ÕIGEKSMÕISTEV: Sirp ei rikkunud eetikakoodeksit. Kuna tegu oli arvamuslooga, siis ei saanud see sisaldada kontserdikorraldaja vastuväiteid ning Sirp avaldas kaebaja seisukohad vastulausena 14. novembril. ",õigeksmõistev,õigeksmõistev,Sirp,kirjutav meedia,[],0,0,0,0,0,0,0,0,0,0,0,0,0,0,0,0,0,0,0,0,0,0,0,0,0,0,0
222,29.10.08,2008,Lääne Elu 25.10.08 Müra tapab kuulmise ,"Kaebaja ei ole rahul, et toimetus avaldas ta artikli kirjade rubriigis ning muudetud kujul. ",pressinõukogu otsus,pressinõukogu otsus,13.11.08,"ÕIGEKSMÕISTEV: Lääne Elu ei ole rikkunud ajakirjanduseetika koodeksit. Pressinõukogu hinnangul oli artikli toimetamine põhjendatud, sest välja jäeti äriühingute nimed, mida toimetus pidas reklaamiks. Samuti on lehe impressumis autoreid hoiatatud, et nende kaastöid võidakse toimetada. Pressinõukogu leiab, et toimetusel on õigus otsustada, kus kaasautorite töid avaldada. ",õigeksmõistev,õigeksmõistev,Lääne Elu,kirjutav meedia,[],0,0,0,0,0,0,0,0,0,0,0,0,0,0,0,0,0,0,0,0,0,0,0,0,0,0,0
216,09.09.08,2008,Eesti Päevaleht 08.09.08 Ülenurme vald: tohutult müümata kinnisvara ,"Kaebaja ei ole rahul, et artiklit illustreeriv foto tema koduõest on tehtud ja avaldatud loata. Kaebaja hinnangul on foto artikli kontekstis eksitav, samuti on eksitav pildialkiri. ",pressinõukogu otsus,pressinõukogu otsus,17.09.08,"ÕIGEKSMÕISTEV: Pressinõukogu leiab, et foto illustreerib artiklit ning on artikli sisuga vastavuses ega eksita lugejaid. Pressinõukogu ei tauni foto avaldamist kaebaja teadmata, sest pilt on tehtud avalikult territooriumilt. Lisaks ei ole fotolt maja täpne asukoht ja omanik tuvastatavad. ",õigeksmõistev,õigeksmõistev,Eesti Päevaleht,kirjutav meedia,[],0,0,0,0,0,0,0,0,0,0,0,0,0,0,0,0,0,0,0,0,0,0,0,0,0,0,0
211,06.06.08,2008,Lääne Elu 31.05.08 Meresõidu võimalikkusest Haapsalus ,"Kaebaja leiab, et antud arvamus sisaldab avalikkust eksitavat infot ja solvab teda. Lisaks ei ole kaebaja rahul, et leht ei avaldanud tema vastulauset. ",pressinõukogu otsus,pressinõukogu otsus,27.08.08,"ÕIGEKSMÕISTEV: Lääne Elu on viimaste kuude jooksul avaldanud Haapsalu sadamakonfliktist hulgaliselt artikleid, sõna on saanud ka Viktor Siilats ning toimetusel on õigus teema käsitlemine teatud hetkel lehe arvamusküljel lõpetada. Pressinõukogu hinnangul ei ole Lääne Elus 31. mail avaldatud fotomontaaþ vastuolus hea ajakirjandustavaga, sest see illustreerib kõrvalolevat arvamuslugu. ",õigeksmõistev,õigeksmõistev,Lääne Elu,kirjutav meedia,[],0,0,0,0,0,0,0,0,0,0,0,0,0,0,0,0,0,0,0,0,0,0,0,0,0,0,0
210,05.06.08,2008,Viru Prospekt 29.05.08 Mainekat ilusaongi süüdistatakse ebaprofessionaalsuses ja jultumuses ,Kaebaja hinnangul sisaldab artikkel valefakte ja moonutatud tsitaate ning kahjustab sellega firma mainet. ,pressinõukogu otsus,pressinõukogu otsus,27.08.08,"ÕIGEKSMÕISTEV: Artiklis Prestiizset ilusalongi süüdistatakse ebaprofessionaalsuses ja jultumuses said sõna mõlemad konfliktipooled. Artikli pealkiri annab edasi kliendi süüdistuse, kuid see ei näita, et salong on juba süüdi. Artikli Salongile tuletati kõike meelde pealkirja ei pea Pressinõukogu väljakutsuvaks, pigem võtab see kokku artiklis olevate eri inimeste arvamused, mis valgustasid juhtunut. ",õigeksmõistev,õigeksmõistev,Viru Prospekt,kirjutav meedia,[],0,0,0,0,0,0,0,0,0,0,0,0,0,0,0,0,0,0,0,0,0,0,0,0,0,0,0
206,22.05.08,2008,Postimees 02.04.08 Koolivägivald sunnib peret kodu vahetama ,"Kaebaja leiab, et artiklis on kontrollimata fakte ning selle tulemusena kahjustab artikkel kooli, töötajate, õpilaste ja lapsevanemate mainet ning tekitab põhjendamata kannatusi. ",pressinõukogu otsus,pressinõukogu otsus,11.06.08,"ÕIGEKSMÕISTEV: Pressinõukogu hinnangul on artiklis saanud sõna kõik osapooled ning nende väidetes ei olnud lehel põhjust kahelda. Konflikti ei eita oma kaebuses ka Jüri Gümnaasiumi direktor. Pressinõukogu leiab, et kooli külastamine ei olnud artikli seisukohast vajalik, sest kool ei pakkunud osapooltega kohtumist. ",õigeksmõistev,õigeksmõistev,Postimees,kirjutav meedia,[],0,0,0,0,0,0,0,0,0,0,0,0,0,0,0,0,0,0,0,0,0,0,0,0,0,0,0
205,09.05.08,2008,Postimees 28.04.08 Pressinõukogu: rahvusringhääling rikkus head ajakirjandustava ,"Kaebaja peab artiklit ebaeetiliseks ja ajakirjanduseetika koodeksiga vastuolus olevaks, sest artikkel käsitleb teda kurjategijana, ehkki Rein Veidemanni solvamises pole teda kohtus süüdi mõistetud. ",pressinõukogu otsus,pressinõukogu otsus,11.06.08,"ÕIGEKSMÕISTEV: Pressinõukogu arvates ei käsitlenud Postimees kaebajat kurjategijana, vaid refereeris Pressinõukogu otsust. Ka Pressinõukogu otsuses ei käsitletud Kivisildnikku kurjategijana. Lisaks andis Postimees kaebajale võimaluse vastulauseks ning avaldas selle 9. mail kohe, kui Sven Sildnik vastulause toimetusele esitas. ",õigeksmõistev,õigeksmõistev,Postimees,kirjutav meedia,[],0,0,0,0,0,0,0,0,0,0,0,0,0,0,0,0,0,0,0,0,0,0,0,0,0,0,0
204,05.05.08,2008,Õpetajate Leht 29.02.08 Müra ei ole informatsioon ,"Kaebaja leiab, et artikkel tekitab talle põhjendamata kannatusi. Lisaks ei ole kaebaja arvates kuulatud ära kõiki osapooli ning antud talle võimalust kommentaariks. Samuti leiab kaebaja, et kirjutis sisaldab ebaõiget infot ja rikub tema eraelu puutumatust. ",pressinõukogu otsus,pressinõukogu otsus,11.06.08,"ÕIGEKSMÕISTEV: Pressinõukogu hinnangul on igal inimesel, sealhulgas ka ajakirjanikel, õigus avaldada arvamust ning esitada arvamusloos küsimusi. Lisaks on antud kommentaari puhul tegu autori hinnanguga mitme erineva inimese, teiste seas Kivisildniku, meedias avaldatud arvamusele. ",õigeksmõistev,õigeksmõistev,Õpetajate Leht,kirjutav meedia,[],0,0,0,0,0,0,0,0,0,0,0,0,0,0,0,0,0,0,0,0,0,0,0,0,0,0,0
202,24.04.08,2008,"Eesti Rahvusringhääling, Vikerraadio, Ummafon 01.03.08 Intervjuu Rein Veidemanniga ","Kaebaja leiab, et saates esitati tema kohta ebatäpset infot ja tõsiseid süüdistusi, kuid kommentaari ega vastulause võimalust ei antud. Samuti käsitleti teda kurjategijana enne sellekohast kohtuotsust. ",pressinõukogu otsus,pressinõukogu otsus,21.05.08,"ÕIGEKSMÕISTEV: Pressinõukogu arvates ei ole Rein Veidemann saates Sven Sildnikku süüdistanud, vaid on andnud hinnangu Kivisildniku raamatus kirjutatu kohta. Pressinõukogu peab loomulikuks Eesti Rahvusringhäälingu seisukohta, et vastastikust süüdistamist, iseäranis kaks kuud hiljem, raadioeetris ei võimaldata. ",õigeksmõistev,õigeksmõistev,ERR,rääkiv meedia,[],0,0,0,0,0,0,0,0,0,0,0,0,0,0,0,0,0,0,0,0,0,0,0,0,0,0,0
196,07.04.08,2008,"Kanal 2, Reporter 04.04.08 Saatelõik vahetusüliõpilase tülist ööklubis ","Kaebaja väitel on Mario Rodriguesi tüli ja tema füüsiline alandamine turvatöötajate poolt vale. Kaebaja ei ole rahul, et tema keeldumine intervjuust oli saates monteeritud ning avalikkus sai vahetusüliõpilaste elust moonutatud pildi. ",pressinõukogu otsus,pressinõukogu otsus,23.04.08,"ÕIGEKSMÕISTEV: Uudislõigu seotus välisüliõpilaste turvalisuse seminariga oli selge ning osapooled said sõna. Pressinõukogu hinnangul oli põhjendatud, et Reporter näitas vaatajatele Eigo Sõsteri keeldumist intervjuust. ",õigeksmõistev,õigeksmõistev,Kanal2,rääkiv meedia,[],0,0,0,0,0,0,0,0,0,0,0,0,0,0,0,0,0,0,0,0,0,0,0,0,0,0,0
192,14.03.08,2008,Postimees 14.03.08 Vägistajatest vennad varastasid Ämari vanglast elektriauto ,"Kaebaja leiab, et artiklis on kasutatud ebaobjektiivset allikat ning artikkel jätab kaebajast mulje, nagu oleks ta soodustanud vanglas erinevaid rikkumisi. ",pressinõukogu otsus,pressinõukogu otsus,23.04.08,"ÕIGEKSMÕISTEV: Pressinõukogu hinnangul on toimetusel õigus valida ise allikaid, kõnealuses artiklis esines allikas oma nime all ning leht andis võimaluse allika väidete kommenteerimiseks ja ümberlükkamiseks nii justiitsministeeriumile kui ka Arvi Laidele, kes seda võimalust ka kasutasid. ",õigeksmõistev,õigeksmõistev,Postimees,kirjutav meedia,[],0,0,0,0,0,0,0,0,0,0,0,0,0,0,0,0,0,0,0,0,0,0,0,0,0,0,0
191,28.02.08,2008,Eesti Päevaleht 25.02.08 Partsi plaan: ajada valitsus lõhki ,"Kaebaja ei ole rahul, et kirjutises on viidatud vaid anonüümsetele allikatele ning ei ole antud sõna neile, kelle kohta esitati tõsiseid süüdistusi. Kaebaja hinnangul kahjustab artikkel IRLi mainet ja levitas tegelikkusele mittevastavat infot. ",pressinõukogu otsus,pressinõukogu otsus,02.04.08,"ÕIGEKSMÕISTEV: Vaidlusalune artikkel on märgistatud sõnaga „analüüs“ ning sellega on kirjutis eristatud teistest uudisteküljel avaldatud materjalidest. Analüüsi puhul on tegu autori hinnanguga ning see ei eelda, et iga väide on konkreetse allikaga varustatud ja faktiga uuesti tõestatud, sest analüüsis nimetatud konfliktide kohta on varem ilmunud uudistes avaldatud kinnitusi nimelistelt allikatelt. Vastavate uudiste loetelu on leht ka esitanud. ",õigeksmõistev,õigeksmõistev,Eesti Päevaleht,kirjutav meedia,[],0,0,0,0,0,0,0,0,0,0,0,0,0,0,0,0,0,0,0,0,0,0,0,0,0,0,0
189,26.02.08,2008,Eesti Ekspress 21.02.08 Eesti Vabariigi ajaloo 90 kõige kultuurivaenulikumat tegu ,"Kaebaja hinnangul on tegu avaliku laimuga, sest ei ole esitatud põhjendust, miks on ta nimi seotud inimsusevastaste kuritegudega. Kaebaja leiab, et tegu on põhjendamata kannatusi tekitava, pahatahtliku, moonutava ja eksitava infoga. Samuti pole kaebajale antud kommentaari võimalust. ",pressinõukogu otsus,pressinõukogu otsus,02.04.08,ÕIGEKSMÕISTEV: Ajakirjanduseetika koodeksist lähtuvalt ei ole antud loo puhul tegu konfliktse materjaliga ning selle þanr välistab osapoolte kommetaarid ja vastulause. Pressinõukogu meelest on avaldatu puhul tegemist satiirilises võtmes esitatud hinnangute kogumiga või edetabeliga ning maitseküsimusega. ,õigeksmõistev,õigeksmõistev,Eesti Ekspress,kirjutav meedia,[],0,0,0,0,0,0,0,0,0,0,0,0,0,0,0,0,0,0,0,0,0,0,0,0,0,0,0
188,25.02.08,2008,Eesti Ekspress 21.02.08 Eesti Vabariigi ajaloo 90 kõige kultuurivaenulikumat tegu ,"Kaebaja hinnangul pole esitatud vähimatki põhjendust, miks tema nimi on antud nimekirjas ning talle pole antud võimalust enda kaitsmiseks. Samuti on tegu ebatäpse ja eksitava infoga, sest inimene ei saa olla ei tegu ega ka sigadus. ",pressinõukogu otsus,pressinõukogu otsus,02.04.08,ÕIGEKSMÕISTEV: Ajakirjanduseetika koodeksist lähtuvalt ei ole antud loo puhul tegu konfliktse materjaliga ning selle þanr välistab osapoolte kommetaarid ja vastulause. Pressinõukogu meelest on avaldatu puhul tegemist satiirilises võtmes esitatud hinnangute kogumiga või edetabeliga ning maitseküsimusega. ,õigeksmõistev,õigeksmõistev,Eesti Ekspress,kirjutav meedia,[],0,0,0,0,0,0,0,0,0,0,0,0,0,0,0,0,0,0,0,0,0,0,0,0,0,0,0
